code,stock_name,exchange,country
PMM,Putnam Managed Municipal Income Trust Common Stock,NYQ,USA
PMO,Putnam Municipal Opportunities Trust Common Stock,NYQ,USA
PMT,PennyMac Mortgage Investment Trust Common Shares of Beneficial Interest,NYQ,USA
PMTS,CPI Card Group Inc. Common Stock,NGM,USA
PMVC,PMV Consumer Acquisition Corp. Class A Common Stock,NYQ,USA
PMVP,PMV Pharmaceuticals Inc. Common Stock,NMS,USA
PMX,PIMCO Municipal Income Fund III Common Shares of Beneficial Interest,NYQ,USA
PNBK,Patriot National Bancorp Inc. Common Stock,NGM,USA
PNC,PNC Financial Services Group Inc. (The) Common Stock,NYQ,USA
PNF,PIMCO New York Municipal Income Fund Common Stock,NYQ,USA
PNFP,Pinnacle Financial Partners Inc. Common Stock,NMS,USA
PNFPP,Pinnacle Financial Partners Inc. Depositary shares of Pinnacle Financial Partners Inc. each representing a 1/40th Interest in a share of its 6.75% Fixed-Rate Non-Cumulative Perpetual Preferred Stock Series B,NMS,USA
PNI,Pimco New York Municipal Income Fund II Common Shares of Beneficial Interest,NYQ,USA
PNM,PNM Resources Inc. (Holding Co.) Common Stock,NYQ,USA
PNNT,PennantPark Investment Corporation Common Stock,NMS,USA
PNNTG,PennantPark Investment Corporation 5.50% Notes Due 2024,NMS,USA
PNRG,PrimeEnergy Resources Corporation Common Stock,NCM,USA
PNT,POINT Biopharma Global Inc. Common Stock,NCM,USA
PNTG,The Pennant Group Inc. Common Stock ,NMS,USA
PNW,Pinnacle West Capital Corporation Common Stock,NYQ,USA
POAI,Predictive Oncology Inc. Common Stock,NCM,USA
PODD,Insulet Corporation Common Stock,NMS,USA
POLA,Polar Power Inc. Common Stock,NCM,USA
POLY,Plantronics Inc. Common Stock,NYQ,USA
PONO,Pono Capital Corp Class A Common Stock,NCM,USA
PONOW,Pono Capital Corp Warrant,NCM,USA
POOL,Pool Corporation Common Stock,NMS,USA
POR,Portland General Electric Co Common Stock,NYQ,USA
POSH,Poshmark Inc. Class A Common Stock,NMS,USA
POST,Post Holdings Inc. Common Stock,NYQ,USA
POW,Powered Brands Class A Ordinary Shares,NCM,USA
POWI,Power Integrations Inc. Common Stock,NMS,USA
POWL,Powell Industries Inc. Common Stock,NMS,USA
POWRU,Powered Brands Units,NCM,USA
POWRW,Powered Brands Warrants,NCM,USA
POWW,AMMO Inc. Common Stock,NCM,USA
POWWP,AMMO Inc. 8.75% Series A Cumulative Redeemable Perpetual Preferred Stock,NCM,USA
PPBI,Pacific Premier Bancorp Inc,NMS,USA
PPC,Pilgrim's Pride Corporation Common Stock,NMS,USA
PPD,PPD Inc. Common Stock,NMS,USA
PPG,PPG Industries Inc. Common Stock,NYQ,USA
PPIH,Perma-Pipe International Holdings Inc. Common Stock,NGM,USA
PPL,PPL Corporation Common Stock,NYQ,USA
PPSI,Pioneer Power Solutions Inc. Common Stock,NCM,USA
PPT,Putnam Premier Income Trust Common Stock,NYQ,USA
PRA,ProAssurance Corporation Common Stock,NYQ,USA
PRAA,PRA Group Inc. Common Stock,NMS,USA
PRAX,Praxis Precision Medicines Inc. Common Stock,NMS,USA
PRCH,Porch Group Inc. Common Stock,NCM,USA
PRCT,PROCEPT BioRobotics Corporation Common Stock,NGM,USA
PRDO,Perdoceo Education Corporation Common Stock,NMS,USA
PRFT,Perficient Inc. Common Stock,NMS,USA
PRG,PROG Holdings Inc. Common Stock,NYQ,USA
PRGO,Perrigo Company plc Ordinary Shares,NYQ,USA
PRGS,Progress Software Corporation Common Stock (DE),NMS,USA
PRI,Primerica Inc. Common Stock,NYQ,USA
PRIM,Primoris Services Corporation Common Stock,NMS,USA
PRK,Park National Corporation Common Stock,ASE,USA
PRLB,Proto Labs Inc. Common stock,NYQ,USA
PRLD,Prelude Therapeutics Incorporated Common Stock,NMS,USA
PRO,PROS Holdings Inc. Common Stock,NYQ,USA
PROG,Progenity Inc. Common Stock,NGM,USA
PROV,Provident Financial Holdings Inc. Common Stock,NMS,USA
PRPB,CC Neuberger Principal Holdings II Class A Ordinary Shares,NYQ,USA
PRPH,ProPhase Labs Inc. Common Stock (DE),NCM,USA
PRPL,Purple Innovation Inc. Common Stock,NMS,USA
PRPO,Precipio Inc.  Common Stock,NCM,USA
PRS,Prudential Financial Inc. 5.625% Junior Subordinated Notes due 2058,NYQ,USA
PRSR,Prospector Capital Corp. Class A Ordinary Shares,NCM,USA
PRSRU,Prospector Capital Corp. Unit,NCM,USA
PRSRW,Prospector Capital Corp. Warrants,NCM,USA
PRT,PermRock Royalty Trust Trust Units,NYQ,USA
PRTA,Prothena Corporation plc Ordinary Shares,NMS,USA
PRTH,Priority Technology Holdings Inc. Common Stock,NCM,USA
PRTK,Paratek Pharmaceuticals Inc. Common Stock,NGM,USA
PRTS,CarParts.com Inc. Common Stock,NMS,USA
PRTY,Party City Holdco Inc. Common Stock,NYQ,USA
PRU,Prudential Financial Inc. Common Stock,NYQ,USA
PRVA,Privia Health Group Inc. Common Stock,NMS,USA
PRVB,Provention Bio Inc. Common Stock,NMS,USA
PSA,Public Storage Common Stock,NYQ,USA
PSAG,Property Solutions Acquisition Corporation II Class A Common Stock,NCM,USA
PSAGU,Property Solutions Acquisition Corporation II Units,NCM,USA
PSAGW,Property Solutions Acquisition Corporation II Warrant,NCM,USA
PSB,PS Business Parks Inc. (MD) Common Stock,NYQ,USA
PSEC,Prospect Capital Corporation Common Stock,NMS,USA
PSMT,PriceSmart Inc. Common Stock,NMS,USA
PSNL,Personalis Inc. Common Stock,NGM,USA
PSTV,PLUS THERAPEUTICS Inc. Common Stock ,NCM,USA
PSTX,Poseida Therapeutics Inc. Common Stock,NMS,USA
PSX,Phillips 66 Common Stock,NYQ,USA
PSXP,Phillips 66 Partners LP Common Units representing limited partner interest in the Partnership,NYQ,USA
PTC,PTC Inc. Common Stock,NMS,USA
PTCT,PTC Therapeutics Inc. Common Stock,NMS,USA
PTE,PolarityTE Inc. Common Stock,NCM,USA
PTEN,Patterson-UTI Energy Inc. Common Stock,NMS,USA
PTGX,Protagonist Therapeutics Inc. Common Stock,NGM,USA
PTIC,PropTech Investment Corporation II Class A Common Stock,NCM,USA
PTICU,PropTech Investment Corporation II Unit,NCM,USA
PTICW,PropTech Investment Corporation II Warrant,NCM,USA
PTIX,Protagenic Therapeutics Inc. Common Stock,NCM,USA
PTIXW,Protagenic Therapeutics Inc. Warrant,NCM,USA
PTLO,Portillo's Inc. Class A Common Stock,NMS,USA
PTMN,Portman Ridge Finance Corporation Common Stock,NMS,USA
PTN,Palatin Technologies Inc. Common Stock,ASE,USA
PTOC,Pine Technology Acquisition Corp. Class A Common Stock,NCM,USA
PTOCU,Pine Technology Acquisition Corp. Unit,NCM,USA
PTOCW,Pine Technology Acquisition Corp. Warrant,NCM,USA
PTON,Peloton Interactive Inc. Class A Common Stock,NMS,USA
PTPI,Petros Pharmaceuticals Inc. Common Stock,NCM,USA
PTRA,Proterra Inc. Common Stock,NMS,USA
PTRS,Partners Bancorp Common Stock,NCM,USA
PTSI,P.A.M. Transportation Services Inc. Common Stock,NGM,USA
PTVE,Pactiv Evergreen Inc. Common stock,NMS,USA
PTY,Pimco Corporate & Income Opportunity Fund,NYQ,USA
PUBM,PubMatic Inc. Class A Common Stock,NGM,USA
PUCK,Goal Acquisitions Corp. Common Stock,NCM,USA
PUCKU,Goal Acquisitions Corp. Unit,NCM,USA
PUCKW,Goal Acquisitions Corp. Warrant,NCM,USA
PULM,Pulmatrix Inc. Common Stock,NCM,USA
PUMP,ProPetro Holding Corp. Common Stock,NYQ,USA
PVBC,Provident Bancorp Inc. (MD) Common Stock,NCM,USA
PVH,PVH Corp. Common Stock,NYQ,USA
PVL,Permianville Royalty Trust Trust Units ,NYQ,USA
PW,Power REIT (MD) Common Stock,ASE,USA
PWFL,PowerFleet Inc. Common Stock,NGM,USA
PWOD,Penns Woods Bancorp Inc. Common Stock,NMS,USA
PWP,Perella Weinberg Partners Class A Common Stock,NMS,USA
PWPPW,Perella Weinberg Partners Warrant,NMS,USA
PWR,Quanta Services Inc. Common Stock,NYQ,USA
PXD,Pioneer Natural Resources Company Common Stock,NYQ,USA
PXLW,Pixelworks Inc.  Common Stock,NGM,USA
PYCR,Paycor HCM Inc. Common Stock,NMS,USA
PYN,PIMCO New York Municipal Income Fund III Common Shares of Beneficial Interest,NYQ,USA
PYPL,PayPal Holdings Inc. Common Stock,NMS,USA
PYS,Merrill Lynch Depositor Inc PPlus Tr Ser RRD-1 Tr Ctf Cl A,NYQ,USA
PYT,PPlus Tr GSC-2 Tr Ctf Fltg Rate,NYQ,USA
PYXS,Pyxis Oncology Inc. Common Stock,NMS,USA
PZC,PIMCO California Municipal Income Fund III Common Shares of Beneficial Interest,NYQ,USA
PZG,Paramount Gold Nevada Corp. Common Stock,ASE,USA
PZN,Pzena Investment Management Inc Class A Common Stock,NYQ,USA
PZZA,Papa John's International Inc. Common Stock,NMS,USA
QADA,QAD Inc. Class A Common Stock,NMS,USA
QADB,QAD Inc. Class B Common Stock,NMS,USA
QCOM,QUALCOMM Incorporated Common Stock,NMS,USA
QCRH,QCR Holdings Inc. Common Stock,NGM,USA
QDEL,Quidel Corporation Common Stock,NMS,USA
QIPT,Quipt Home Medical Corp. Common Shares,NCM,USA
QLGN,Qualigen Therapeutics Inc. Common Stock,NCM,USA
QLYS,Qualys Inc. Common Stock,NMS,USA
QMCO,Quantum Corporation Common Stock,NGM,USA
QNST,QuinStreet Inc. Common Stock,NMS,USA
QQQX,Nuveen NASDAQ 100 Dynamic Overwrite Fund Shares of Beneficial Interest,NMS,USA
QRHC,Quest Resource Holding Corporation Common Stock,NCM,USA
QRTEA,Qurate Retail Inc. Series A Common Stock ,NMS,USA
QRTEB,Qurate Retail Inc. Series B Common Stock ,NMS,USA
QRTEP,Qurate Retail Inc. 8.0% Fixed Rate Cumulative Redeemable Preferred Stock,NMS,USA
QRVO,Qorvo Inc. Common Stock,NMS,USA
QS,QuantumScape Corporation Class A Common Stock,NYQ,USA
QSI,Quantum-Si Incorporated Class A Common Stock,NGM,USA
QSIAW,Quantum-Si Incorporated Warrant,NGM,USA
QTRX,Quanterix Corporation Common Stock,NGM,USA
QUAD,Quad Graphics Inc Class A Common Stock,NYQ,USA
QUBT,Quantum Computing Inc. Common Stock,NCM,USA
QUIK,QuickLogic Corporation Common Stock,NCM,USA
QUMU,Qumu Corporation Common Stock,NCM,USA
QVCC,QVC Inc. 6.250% Senior Secured Notes due 2068,NYQ,USA
QVCD,QVC Inc. 6.375% Senior Secured Notes due 2067,NYQ,USA
R,Ryder System Inc. Common Stock,NYQ,USA
RACB,Research Alliance Corp. II Class A Common Stock,NCM,USA
RAD,Rite Aid Corporation Common Stock,NYQ,USA
RADI,Radius Global Infrastructure Inc. Class A Common Stock,NGM,USA
RAIL,FreightCar America Inc. Common Stock,NMS,USA
RAIN,Rain Therapeutics Inc. Common Stock,NMS,USA
RAMP,LiveRamp Holdings Inc. Common Stock,NYQ,USA
RAND,Rand Capital Corporation Common Stock,NCM,USA
RANI,Rani Therapeutics Holdings Inc. Class A Common Stock,NGM,USA
RAPT,RAPT Therapeutics Inc. Common Stock,NGM,USA
RARE,Ultragenyx Pharmaceutical Inc. Common Stock,NMS,USA
RAVE,Rave Restaurant Group Inc. Common Stock,NCM,USA
RAVN,Raven Industries Inc. Common Stock,NMS,USA
RBAC,RedBall Acquisition Corp. Class A Ordinary Shares,NYQ,USA
RBB,RBB Bancorp Common Stock,NMS,USA
RBBN,Ribbon Communications Inc. Common Stock,NMS,USA
RBCAA,Republic Bancorp Inc. Class A Common Stock,NMS,USA
RBCN,Rubicon Technology Inc. Common Stock,NCM,USA
RBKB,Rhinebeck Bancorp Inc. Common Stock,NCM,USA
RBNC,Reliant Bancorp Inc. Common Stock,NCM,USA
RC,Ready Capital Corproation Common Stock,NYQ,USA
RCA,Ready Capital Corporation 7.00% Convertible Senior Notes due 2023,NYQ,USA
RCAT,Red Cat Holdings Inc. Common Stock,NCM,USA
RCB,Ready Capital Corporation 6.20% Senior Notes due 2026,NYQ,USA
RCC,Ready Capital Corporation 5.75% Senior Notes due 2026,NYQ,USA
RCEL,Avita Therapeutics Inc. Common Stock,NCM,USA
RCG,RENN Fund Inc Common Stock,NYQ,USA
RCHG,Recharge Acquisition Corp. Class A Common Stock,NCM,USA
RCHGU,Recharge Acquisition Corp. Unit,NCM,USA
RCHGW,Recharge Acquisition Corp. Warrant,NCM,USA
RCII,Rent-A-Center Inc. Common Stock,NMS,USA
RCKT,Rocket Pharmaceuticals Inc. Common Stock,NGM,USA
RCKY,Rocky Brands Inc. Common Stock,NMS,USA
RCL,D/B/A Royal Caribbean Cruises Ltd. Common Stock,NYQ,USA
RCLF,Rosecliff Acquisition Corp I Class A Common Stock,NCM,USA
RCLFU,Rosecliff Acquisition Corp I Unit,NCM,USA
RCLFW,Rosecliff Acquisition Corp I Warrants,NCM,USA
RCM,R1 RCM Inc. Common Stock,NMS,USA
RCMT,RCM Technologies Inc. Common Stock,NGM,USA
RCRT,Recruiter.com Group Inc. Common Stock,NCM,USA
RCRTW,Recruiter.com Group Inc. Warrant,NCM,USA
RCS,PIMCO Strategic Income Fund Inc.,NYQ,USA
RDBX,Redbox Entertainment Inc. Class A Common Stock,NGM,USA
RDBXW,Redbox Entertainment Inc. Warrant,NGM,USA
RDFN,Redfin Corporation Common Stock,NMS,USA
RDI,Reading International Inc Class A Common Stock,NCM,USA
RDIB,Reading International Inc Class B Common Stock,NCM,USA
RDN,Radian Group Inc. Common Stock,NYQ,USA
RDNT,RadNet Inc. Common Stock,NGM,USA
RDUS,Radius Health Inc. Common Stock,NGM,USA
RDVT,Red Violet Inc. Common Stock ,NCM,USA
RDW,Redwire Corporation Common Stock,NYQ,USA
REAL,The RealReal Inc. Common Stock,NMS,USA
REED,Reeds Inc. Common Stock,NCM,USA
REFR,Research Frontiers Incorporated Common Stock,NCM,USA
REG,Regency Centers Corporation Common Stock,NMS,USA
REGI,Renewable Energy Group Inc. Common Stock,NMS,USA
REGN,Regeneron Pharmaceuticals Inc. Common Stock,NMS,USA
REI,Ring Energy Inc. Common Stock,ASE,USA
REKR,Rekor Systems Inc. Common Stock,NCM,USA
RELI,Reliance Global Group Inc. Common Stock,NCM,USA
RELIW,Reliance Global Group Inc. Series A Warrants,NCM,USA
RELL,Richardson Electronics Ltd. Common Stock,NMS,USA
RELY,Remitly Global Inc. Common Stock,NMS,USA
RENT,Rent the Runway Inc. Class A Common Stock,NMS,USA
REPH,Recro Pharma Inc. Common Stock,NCM,USA
REPL,Replimune Group Inc. Common Stock,NMS,USA
REPX,Riley Exploration Permian Inc. Common Stock,ASE,USA
RES,RPC Inc. Common Stock,NYQ,USA
RESN,Resonant Inc. Common Stock,NCM,USA
RETA,Reata Pharmaceuticals Inc. Class A Common Stock,NGM,USA
REV,Revlon Inc. New Common Stock,NYQ,USA
REVE,Alpine Acquisition Corporation Common Stock,NCM,USA
REVEU,Alpine Acquisition Corporation Unit,NCM,USA
REVEW,Alpine Acquisition Corporation Warrant,NGM,USA
REVG,REV Group Inc. Common Stock,NYQ,USA
REVH,Revolution Healthcare Acquisition Corp. SAIL Class A Common Stock,NCM,USA
REVHU,Revolution Healthcare Acquisition Corp. SAIL Units,NCM,USA
REVHW,Revolution Healthcare Acquisition Corp. SAIL Warrant.,NCM,USA
REX,REX American Resources Corporation,NYQ,USA
REXR,Rexford Industrial Realty Inc. Common Stock,NYQ,USA
REYN,Reynolds Consumer Products Inc. Common Stock,NMS,USA
RF,Regions Financial Corporation Common Stock,NYQ,USA
RFI,Cohen & Steers Total Return Realty Fund Inc. Common Stock,NYQ,USA
RFIL,RF Industries Ltd. Common Stock,NGM,USA
RFL,Rafael Holdings Inc. Class B Common Stock,NYQ,USA
RGA,Reinsurance Group of America Incorporated Common Stock,NYQ,USA
RGCO,RGC Resources Inc. Common Stock,NGM,USA
RGEN,Repligen Corporation Common Stock,NMS,USA
RGLD,Royal Gold Inc. Common Stock,NMS,USA
RGLS,Regulus Therapeutics Inc. Common Stock,NCM,USA
RGNX,REGENXBIO Inc. Common Stock,NMS,USA
RGP,Resources Connection Inc. Common Stock,NMS,USA
RGR,Sturm Ruger & Company Inc. Common Stock,NYQ,USA
RGS,Regis Corporation Common Stock,NYQ,USA
RH,RH Common Stock,NYQ,USA
RHI,Robert Half International Inc. Common Stock,NYQ,USA
RHP,Ryman Hospitality Properties Inc. (REIT),NYQ,USA
RIBT,RiceBran Technologies Common Stock,NCM,USA
RICK,RCI Hospitality Holdings Inc. Common Stock,NGM,USA
RIDE,Lordstown Motors Corp. Class A Common Stock,NMS,USA
RIGL,Rigel Pharmaceuticals Inc. Common Stock,NMS,USA
RILY,B. Riley Financial Inc. Common Stock,NGM,USA
RILYK,B. Riley Financial Inc. 5.50% Senior Notes Due 2026,NGM,USA
RILYL,B. Riley Financial Inc. Depositary Shares each representing 1/1000th in a share of 7.375% Series B Cumulative Perpetual Preferred Stock par value $0.0001,NGM,USA
RILYM,B. Riley Financial Inc. 6.375% Senior Notes due 2025,NGM,USA
RILYN,B. Riley Financial Inc. 6.50% Senior Notes Due 2026,NGM,USA
RILYO,B. Riley Financial Inc. 6.75% Senior Notes due 2024,NGM,USA
RILYP,B. Riley Financial Inc. Depositary Shares each representing a 1/1000th fractional interest in a share of Series A Cumulative Perpetual Preferred Stock,NGM,USA
RILYT,B. Riley Financial Inc. 6.00% Senior Notes Due 2028,NGM,USA
RILYZ,B. Riley Financial Inc. 5.25% Senior Notes due 2028,NGM,USA
RIOT,Riot Blockchain Inc.  Common Stock ,NCM,USA
RIVE,Riverview Financial Corporation Common Stock,NGM,USA
RJF,Raymond James Financial Inc. Common Stock,NYQ,USA
RKDA,Arcadia Biosciences Inc. Common Stock,NCM,USA
RKLB,Rocket Lab USA Inc. Common Stock,NCM,USA
RKLBW,Rocket Lab USA Inc. Warrant,NCM,USA
RKT,Rocket Companies Inc. Class A Common Stock,NYQ,USA
RL,Ralph Lauren Corporation Common Stock,NYQ,USA
RLAY,Relay Therapeutics Inc. Common Stock,NGM,USA
RLGY,Realogy Holdings Corp. Common Stock,NYQ,USA
RLI,RLI Corp. Common Stock (DE),NYQ,USA
RLJ,RLJ Lodging Trust Common Shares of Beneficial Interest $0.01 par value,NYQ,USA
RLMD,Relmada Therapeutics Inc. Common Stock,NMS,USA
RLYB,Rallybio Corporation Common Stock,NMS,USA
RM,Regional Management Corp. Common Stock,NYQ,USA
RMBI,Richmond Mutual Bancorporation Inc. Common Stock,NCM,USA
RMBL,RumbleOn Inc. Class B Common Stock,NCM,USA
RMBS,Rambus Inc. Common Stock,NMS,USA
RMCF,Rocky Mountain Chocolate Factory Inc. Common Stock,NGM,USA
RMD,ResMed Inc. Common Stock,NYQ,USA
RMGC,RMG Acquisition Corp. III Class A Ordinary Shares,NCM,USA
RMGCU,RMG Acquisition Corp. III Unit,NCM,USA
RMGCW,RMG Acquisition Corp. III Warrant,NCM,USA
RMNI,Rimini Street Inc. (DE) Common Stock,NGM,USA
RMR,The RMR Group Inc. Class A Common Stock,NCM,USA
RMT,Royce Micro-Cap Trust Inc. Common Stock,NYQ,USA
RMTI,Rockwell Medical Inc. (DE) Common Stock,NGM,USA
RNA,Avidity Biosciences Inc. Common Stock,NGM,USA
RNAZ,TransCode Therapeutics Inc. Common Stock,NCM,USA
RNDB,Randolph Bancorp Inc. Common Stock,NGM,USA
RNGR,Ranger Energy Services Inc. Class A Common Stock,NYQ,USA
RNP,Cohen & Steers REIT and Preferred and Income Fund Inc. Common Shares,NYQ,USA
RNST,Renasant Corporation Common Stock,NMS,USA
RNWK,RealNetworks Inc. Common Stock,NMS,USA
RNXT,RenovoRx Inc. Common Stock,NCM,USA
ROAD,Construction Partners Inc. Class A Common Stock,NMS,USA
ROCC,Ranger Oil Corporation Class A Common Stock,NMS,USA
ROCG,Roth CH Acquisition IV Co. Common Stock,NCM,USA
ROCGU,Roth CH Acquisition IV Co. Unit,NCM,USA
ROCGW,Roth CH Acquisition IV Co. Warrant,NCM,USA
ROCK,Gibraltar Industries Inc. Common Stock,NMS,USA
ROCR,Roth CH Acquisition III Co. Common stock,NCM,USA
ROCRU,Roth CH Acquisition III Co. Unit,NCM,USA
ROCRW,Roth CH Acquisition III Co. Warrant,NCM,USA
ROG,Rogers Corporation Common Stock,NYQ,USA
ROIC,Retail Opportunity Investments Corp. Common Stock (MD),NMS,USA
ROK,Rockwell Automation Inc. Common Stock,NYQ,USA
ROKU,Roku Inc. Class A Common Stock,NMS,USA
ROL,Rollins Inc. Common Stock,NYQ,USA
ROLL,RBC Bearings Incorporated Common Stock,NMS,USA
ROLLP,RBC Bearings Incorporated 5.00% Series A Mandatory Convertible Preferred Stock,NMS,USA
ROOT,Root Inc. Class A Common Stock,NMS,USA
ROP,Roper Technologies Inc. Common Stock,NYQ,USA
ROSEU,Rose Hill Acquisition Corporation Unit,NGM,USA
ROST,Ross Stores Inc. Common Stock,NMS,USA
ROVR,Rover Group Inc. Class A Common Stock,NGM,USA
ROVRW,Rover Group Inc. Warrant,NGM,USA
RPAY,Repay Holdings Corporation Class A Common Stock,NCM,USA
RPD,Rapid7 Inc. Common Stock,NGM,USA
RPHM,Reneo Pharmaceuticals Inc. Common Stock,NGM,USA
RPID,Rapid Micro Biosystems Inc. Class A Common Stock,NMS,USA
RPM,RPM International Inc. Common Stock,NYQ,USA
RPRX,Royalty Pharma plc Class A Ordinary Shares ,NMS,USA
RPT,RPT Realty Common Stock,NYQ,USA
RQI,Cohen & Steers Quality Income Realty Fund Inc Common Shares,NYQ,USA
RRBI,Red River Bancshares Inc. Common Stock,NMS,USA
RRC,Range Resources Corporation Common Stock,NYQ,USA
RRD,R.R. Donnelley & Sons Company Common Stock,NYQ,USA
RRGB,Red Robin Gourmet Burgers Inc. Common Stock,NMS,USA
RRR,Red Rock Resorts Inc. Class A Common Stock,NMS,USA
RRX,Regal Rexnord Corporation Common Stock,NYQ,USA
RS,Reliance Steel & Aluminum Co. Common Stock (DE),NYQ,USA
RSG,Republic Services Inc. Common Stock,NYQ,USA
RSLS,ReShape Lifesciences Inc. Common Stock,NCM,USA
RSSS,Research Solutions Inc Common Stock,NCM,USA
RSVR,Reservoir Media Inc. Common Stock,NGM,USA
RSVRW,Reservoir Media Inc. Warrant,NGM,USA
RTLR,Rattler Midstream LP Common Units,NMS,USA
RTPY,Reinvent Technology Partners Y Class A Ordinary Shares,NCM,USA
RTPYU,Reinvent Technology Partners Y Unit,NCM,USA
RTPYW,Reinvent Technology Partners Y Warrant,NCM,USA
RTX,Raytheon Technologies Corporation Common Stock,NYQ,USA
RUBY,Rubius Therapeutics Inc. Common Stock,NMS,USA
RUN,Sunrun Inc. Common Stock,NMS,USA
RUSHA,Rush Enterprises Inc. Common Stock Cl A,NMS,USA
RUSHB,Rush Enterprises Inc. Class B,NMS,USA
RUTH,Ruth's Hospitality Group Inc. Common Stock,NMS,USA
RVAC,Riverview Acquisition Corp. Class A Common Stock,NCM,USA
RVACU,Riverview Acquisition Corp. Unit,NCM,USA
RVACW,Riverview Acquisition Corp. Warrant,NCM,USA
RVI,Retail Value Inc. Common Stock ,NYQ,USA
RVMD,Revolution Medicines Inc. Common Stock,NMS,USA
RVNC,Revance Therapeutics Inc. Common Stock,NGM,USA
RVP,Retractable Technologies Inc. Common Stock,ASE,USA
RVPH,Reviva Pharmaceuticals Holdings Inc. Common Stock ,NCM,USA
RVPHW,Reviva Pharmaceuticals Holdings Inc. Warrants,NCM,USA
RVSB,Riverview Bancorp Inc Common Stock,NMS,USA
RVT,Royce Value Trust Inc. Common Stock,NYQ,USA
RWAY,Runway Growth Finance Corp. Common Stock,NMS,USA
RWT,Redwood Trust Inc. Common Stock,NYQ,USA
RXDX,Prometheus Biosciences Inc. Common Stock,NMS,USA
RXRA,RXR Acquisition Corp. Class A Common Stock,NCM,USA
RXRAU,RXR Acquisition Corp. Units,NCM,USA
RXRAW,RXR Acquisition Corp. Warrants to purchase Class A common stock,NCM,USA
RXRX,Recursion Pharmaceuticals Inc. Class A Common Stock,NMS,USA
RXST,RxSight Inc. Common Stock,NGM,USA
RXT,Rackspace Technology Inc. Common Stock,NMS,USA
RYAM,Rayonier Advanced Materials Inc. Common Stock,NYQ,USA
RYI,Ryerson Holding Corporation Common Stock,NYQ,USA
RYN,Rayonier Inc. REIT Common Stock,NYQ,USA
RYTM,Rhythm Pharmaceuticals Inc. Common Stock,NGM,USA
RZA,Reinsurance Group of America Incorporated 6.20% Fixed-to-Floating Rate Subordinated Debentures due 2042,NYQ,USA
RZB,Reinsurance Group of America Incorporated 5.75% Fixed-To-Floating Rate Subordinated Debentures due 2056,NYQ,USA
RZLT,Rezolute Inc. Common Stock (NV),NCM,USA
SABR,Sabre Corporation Common Stock,NMS,USA
SABRP,Sabre Corporation 6.50% Series A Mandatory Convertible Preferred Stock,NMS,USA
SABS,SAB Biotherapeutics Inc. Common Stock,NGM,USA
SABSW,SAB Biotherapeutics Inc. Warrant,NGM,USA
SACC,Sachem Capital Corp. 6.875% Notes due 2024,ASE,USA
SACH,Sachem Capital Corp. Common Shares,ASE,USA
SAFE,Safehold Inc. Common Stock,NYQ,USA
SAFM,Sanderson Farms Inc. Common Stock,NMS,USA
SAFT,Safety Insurance Group Inc. Common Stock,NMS,USA
SAGE,Sage Therapeutics Inc. Common Stock,NGM,USA
SAH,Sonic Automotive Inc. Common Stock,NYQ,USA
SAIA,Saia Inc. Common Stock,NMS,USA
SAIL,SailPoint Technologies Holdings Inc. Common Stock,NYQ,USA
SAK,Saratoga Investment Corp 7.25% Notes due 2025,NYQ,USA
SAL,Salisbury Bancorp Inc. Common Stock,NCM,USA
SALM,Salem Media Group Inc. Class A Common Stock,NGM,USA
SAM,Boston Beer Company Inc. (The) Common Stock,NYQ,USA
SAMAU,Schultze Special Purpose Acquisition Corp. II Units,NGM,USA
SAMG,Silvercrest Asset Management Group Inc. Class A Common Stock,NGM,USA
SANA,Sana Biotechnology Inc. Common Stock,NMS,USA
SANBU,Sanaby Health Acquisition Corp. I Unit,NGM,USA
SANM,Sanmina Corporation Common Stock,NMS,USA
SANW,S&W Seed Company Common Stock (NV),NCM,USA
SAR,Saratoga Investment Corp New,NYQ,USA
SASR,Sandy Spring Bancorp Inc. Common Stock,NMS,USA
SATS,EchoStar  Corporation Common Stock,NMS,USA
SAVA,Cassava Sciences Inc. Common Stock,NCM,USA
SAVE,Spirit Airlines Inc. Common Stock,NYQ,USA
SBAC,SBA Communications Corporation Class A Common Stock,NMS,USA
SBCF,Seacoast Banking Corporation of Florida Common Stock,NMS,USA
SBEA,SilverBox Engaged Merger Corp I Class A Common Stock,NCM,USA
SBEAU,SilverBox Engaged Merger Corp I Units,NCM,USA
SBEAW,SilverBox Engaged Merger Corp I Warrant,NCM,USA
SBFG,SB Financial Group Inc. Common Stock,NCM,USA
SBGI,Sinclair Broadcast Group Inc. Class A Common Stock,NMS,USA
SBH,Sally Beauty Holdings Inc. (Name to be changed from Sally Holdings Inc.) Common Stock,NYQ,USA
SBI,Western Asset Intermediate Muni Fund Inc Common Stock,NYQ,USA
SBNY,Signature Bank Common Stock,NMS,USA
SBNYP,Signature Bank Depositary shares each representing a 1/40th ownership interest in a share of 5.000% Noncumulative Perpetual Series A Preferred Stock,NMS,USA
SBR,Sabine Royalty Trust Common Stock,NYQ,USA
SBRA,Sabra Health Care REIT Inc. Common Stock,NMS,USA
SBSI,Southside Bancshares Inc. Common Stock,NMS,USA
SBT,Sterling Bancorp Inc. Common Stock,NCM,USA
SBTX,Silverback Therapeutics Inc. Common Stock,NGM,USA
SBUX,Starbucks Corporation Common Stock,NMS,USA
SCAQ,Stratim Cloud Acquisition Corp. Class A Common Stock,NCM,USA
SCAQU,Stratim Cloud Acquisition Corp. Unit,NCM,USA
SCAQW,Stratim Cloud Acquisition Corp. Warrant,NCM,USA
SCCB,Sachem Capital Corp. 7.125% Notes due 2024,ASE,USA
SCCC,Sachem Capital Corp. 7.75% Notes due 2025,ASE,USA
SCCO,Southern Copper Corporation Common Stock,NYQ,USA
SCD,LMP Capital and Income Fund Inc. Common Stock,NYQ,USA
SCHL,Scholastic Corporation Common Stock,NMS,USA
SCHN,Schnitzer Steel Industries Inc. Class A Common Stock,NMS,USA
SCHW,Charles Schwab Corporation (The) Common Stock,NYQ,USA
SCI,Service Corporation International Common Stock,NYQ,USA
SCKT,Socket Mobile Inc. Common Stock,NCM,USA
SCL,Stepan Company Common Stock,NYQ,USA
SCLE,Broadscale Acquisition Corp. Class A common stock,NCM,USA
SCLEU,Broadscale Acquisition Corp. Units,NCM,USA
SCLEW,Broadscale Acquisition Corp. Warrant,NCM,USA
SCM,Stellus Capital Investment Corporation Common Stock,NYQ,USA
SCMAU,Seaport Calibre Materials Acquisition Corp. Unit,NGM,USA
SCOR,comScore Inc. Common Stock,NMS,USA
SCPH,scPharmaceuticals Inc. Common Stock,NMS,USA
SCPL,SciPlay Corporation Class A Common Stock,NMS,USA
SCPS,Scopus BioPharma Inc. Common Stock,NGM,USA
SCS,Steelcase Inc. Common Stock,NYQ,USA
SCSC,ScanSource Inc. Common Stock,NMS,USA
SCU,Sculptor Capital Management Inc. Class A Common Stock,NYQ,USA
SCVL,Shoe Carnival Inc. Common Stock,NMS,USA
SCWX,SecureWorks Corp. Class A Common Stock,NMS,USA
SCX,L.S. Starrett Company (The) Common Stock,NYQ,USA
SCYX,SCYNEXIS Inc. Common Stock,NGM,USA
SDAC,Sustainable Development Acquisition I Corp. Class A Common Stock,NCM,USA
SDACU,Sustainable Development Acquisition I Corp. Unit,NCM,USA
SDACW,Sustainable Development Acquisition I Corp. Warrant,NCM,USA
