code,stock_name,exchange,country
CSGP,CoStar Group Inc. Common Stock,NMS,USA
CSGS,CSG Systems International Inc. Common Stock,NMS,USA
CSII,Cardiovascular Systems Inc. Common Stock,NMS,USA
CSL,Carlisle Companies Incorporated Common Stock,NYQ,USA
CSPI,CSP Inc. Common Stock,NGM,USA
CSQ,Calamos Strategic Total Return Common Stock,NGM,USA
CSR,D/B/A Centerspace Common Stock,NYQ,USA
CSSE,Chicken Soup for the Soul Entertainment Inc. Class A Common Stock,NGM,USA
CSSEN,Chicken Soup for the Soul Entertainment Inc. 9.50% Notes due 2025,NGM,USA
CSSEP,Chicken Soup for the Soul Entertainment Inc. 9.75% Series A Cumulative Redeemable Perpetual Preferred Stock,NGM,USA
CSTL,Castle Biosciences Inc. Common Stock,NGM,USA
CSTR,CapStar Financial Holdings Inc. Common Stock,NMS,USA
CSU,Capital Senior Living Corporation Common Stock,NYQ,USA
CSV,Carriage Services Inc. Common Stock,NYQ,USA
CSWC,Capital Southwest Corporation Common Stock,NMS,USA
CSWI,CSW Industrials Inc. Common Stock,NMS,USA
CSX,CSX Corporation Common Stock,NMS,USA
CTAQ,Carney Technology Acquisition Corp. II Class A Common Stock,NCM,USA
CTAQU,Carney Technology Acquisition Corp. II Units,NCM,USA
CTAQW,Carney Technology Acquisition Corp. II Warrant,NCM,USA
CTAS,Cintas Corporation Common Stock,NMS,USA
CTBB,Qwest Corporation 6.5% Notes due 2056,NYQ,USA
CTBI,Community Trust Bancorp Inc. Common Stock,NMS,USA
CTDD,Qwest Corporation 6.75% Notes due 2057,NYQ,USA
CTEK,CynergisTek Inc. Common Stock,ASE,USA
CTG,Computer Task Group Inc. Common Stock,NMS,USA
CTHR,Charles & Colvard Ltd Common Stock,NCM,USA
CTIB,Yunhong CTI Ltd. Common Stock,NCM,USA
CTIC,CTI BioPharma Corp. (DE) Common Stock,NCM,USA
CTKB,Cytek Biosciences Inc. Common Stock,NMS,USA
CTLP,Cantaloupe Inc. Common Stock,NMS,USA
CTLT,Catalent Inc. Common Stock,NYQ,USA
CTMX,CytomX Therapeutics Inc. Common Stock,NMS,USA
CTO,CTO Realty Growth Inc. Common Stock,NYQ,USA
CTR,ClearBridge MLP and Midstream Total Return Fund Inc. Common Stock,NYQ,USA
CTRA,Coterra Energy Inc. Common Stock,NYQ,USA
CTRE,CareTrust REIT Inc. Common Stock,NMS,USA
CTRN,Citi Trends Inc. Common Stock,NMS,USA
CTS,CTS Corporation Common Stock,NYQ,USA
CTSH,Cognizant Technology Solutions Corporation Class A Common Stock,NMS,USA
CTSO,Cytosorbents Corporation Common Stock,NCM,USA
CTT,CatchMark Timber Trust Inc. Class A Common Stock,NYQ,USA
CTXR,Citius Pharmaceuticals Inc. Common Stock,NCM,USA
CTXRW,Citius Pharmaceuticals Inc. Warrant,NCM,USA
CTXS,Citrix Systems Inc. Common Stock,NMS,USA
CUBA,Herzfeld Caribbean Basin Fund Inc. (The) Common Stock,NGM,USA
CUBB,Customers Bancorp Inc 5.375% Subordinated Notes Due 2034,NYQ,USA
CUBE,CubeSmart Common Shares,NYQ,USA
CUBI,Customers Bancorp Inc Common Stock,NYQ,USA
CUE,Cue Biopharma Inc. Common Stock,NCM,USA
CUEN,Cuentas Inc. Common Stock,NCM,USA
CUENW,Cuentas Inc. Warrant,NCM,USA
CUK,Carnival Plc ADS ADS,NYQ,USA
CULL,Cullman Bancorp Inc. Common Stock,NCM,USA
CULP,Culp Inc. Common Stock,NYQ,USA
CURI,CuriosityStream Inc. Class A Common Stock,NCM,USA
CURIW,CuriosityStream Inc. Warrant,NCM,USA
CUTR,Cutera Inc. Common Stock,NMS,USA
CUZ,Cousins Properties Incorporated Common Stock,NYQ,USA
CVA,Covanta Holding Corporation Common Stock,NYQ,USA
CVBF,CVB Financial Corporation Common Stock,NMS,USA
CVCO,Cavco Industries Inc. Common Stock When Issued,NMS,USA
CVCY,Central Valley Community Bancorp Common Stock,NCM,USA
CVET,Covetrus Inc. Common Stock,NMS,USA
CVGI,Commercial Vehicle Group Inc. Common Stock,NMS,USA
CVGW,Calavo Growers Inc. Common Stock,NMS,USA
CVI,CVR Energy Inc. Common Stock,NYQ,USA
CVLG,Covenant Logistics Group Inc. Class A Common Stock,NMS,USA
CVLT,Commvault Systems Inc. Common Stock,NMS,USA
CVLY,Codorus Valley Bancorp Inc Common Stock,NGM,USA
CVM,Cel-Sci Corporation Common Stock,ASE,USA
CVNA,Carvana Co. Class A Common Stock,NYQ,USA
CVR,Chicago Rivet & Machine Co. Common Stock,ASE,USA
CVRX,CVRx Inc. Common Stock,NMS,USA
CVS,CVS Health Corporation Common Stock,NYQ,USA
LXP^C,Lexington Realty Trust  Preferred Conv. Series C,,USA
CVU,CPI Aerostructures Inc. Common Stock,ASE,USA
CVV,CVD Equipment Corporation Common Stock,NCM,USA
CVX,Chevron Corporation Common Stock,NYQ,USA
CW,Curtiss-Wright Corporation Common Stock,NYQ,USA
CWBC,Community West Bancshares Common Stock,NGM,USA
CWBR,CohBar Inc. Common Stock,NCM,USA
CWEN,Clearway Energy Inc. Class C Common Stock,NYQ,USA
CWH,Camping World Holdings Inc. Class A Commom Stock,NYQ,USA
CWST,Casella Waste Systems Inc. Class A Common Stock,NMS,USA
CWT,California Water Service Group Common Stock,NYQ,USA
CXDO,Crexendo Inc. Common Stock,NCM,USA
CXE,MFS High Income Municipal Trust Common Stock,NYQ,USA
CXH,MFS Investment Grade Municipal Trust Common Stock,NYQ,USA
MAA^I,Mid-America Apartment Communities Inc. 8.50% Series I Cumulative Redeemable Preferred Stock,,USA
CXP,Columbia Property Trust Inc. Common Stock,NYQ,USA
CXW,CoreCivic Inc. Common Stock,NYQ,USA
CYAN,Cyanotech Corporation Common Stock,NCM,USA
CYBE,CyberOptics Corporation Common Stock,NGM,USA
CYCC,Cyclacel Pharmaceuticals Inc. Common Stock,NCM,USA
CYCCP,Cyclacel Pharmaceuticals Inc. 6% Convertible Preferred Stock,NCM,USA
CYCN,Cyclerion Therapeutics Inc. Common Stock,NMS,USA
CYH,Community Health Systems Inc. Common Stock,NYQ,USA
CYN,Cyngn Inc. Common Stock,NCM,USA
CYRN,CYREN Ltd. Ordinary Shares,NCM,USA
CYRX,CryoPort Inc. Common Stock,NCM,USA
CYT,Cyteir Therapeutics Inc. Common Stock,NMS,USA
CYTH,Cyclo Therapeutics Inc. Common Stock,NCM,USA
CYTK,Cytokinetics Incorporated Common Stock,NMS,USA
CYXT,Cyxtera Technologies Inc. Class A Common Stock,NMS,USA
CYXTW,Cyxtera Technologies Inc. Warrant,NMS,USA
CZNC,Citizens & Northern Corp Common Stock,NCM,USA
CZR,Caesars Entertainment Inc. Common Stock,NMS,USA
CZWI,Citizens Community Bancorp Inc. Common Stock,NGM,USA
D,Dominion Energy Inc. Common Stock,NYQ,USA
DAIO,Data I/O Corporation Common Stock,NCM,USA
DAKT,Daktronics Inc. Common Stock,NMS,USA
DAL,Delta Air Lines Inc. Common Stock,NYQ,USA
DALN,DallasNews Corporation Series A Common Stock,NCM,USA
DALS,DA32 Life Science Tech Acquisition Corp. Class A Common Stock,NCM,USA
DAN,Dana Incorporated Common Stock ,NYQ,USA
DAR,Darling Ingredients Inc. Common Stock,NYQ,USA
DARE,Dare Bioscience Inc. Common Stock,NCM,USA
DATS,DatChat Inc. Common Stock,NCM,USA
DATSW,DatChat Inc. Series A Warrant,NCM,USA
DAWN,Day One Biopharmaceuticals Inc. Common Stock,NMS,USA
DBD,Diebold Nixdorf Incorporated Common Stock,NYQ,USA
DBDR,Roman DBDR Tech Acquisition Corp. Class A Common Stock,NCM,USA
DBDRU,Roman DBDR Tech Acquisition Corp. Unit,NCM,USA
DBDRW,Roman DBDR Tech Acquisition Corp. Warrant,NCM,USA
DBGI,Digital Brands Group Inc. Common Stock,NCM,USA
DBGIW,Digital Brands Group Inc. Warrant,NCM,USA
DBI,Designer Brands Inc. Class A Common Stock,NYQ,USA
DBL,DoubleLine Opportunistic Credit Fund Common Shares of Beneficial Interest,NYQ,USA
DBRG,DigitalBridge Group Inc.,NYQ,USA
DBTX,Decibel Therapeutics Inc. Common Stock,NMS,USA
DBX,Dropbox Inc. Class A Common Stock,NMS,USA
DCI,Donaldson Company Inc. Common Stock,NYQ,USA
DCO,Ducommun Incorporated Common Stock,NYQ,USA
DCOM,Dime Community Bancshares Inc. Common Stock,NMS,USA
DCOMP,Dime Community Bancshares Inc. Fixed-Rate Non-Cumulative Perpetual Preferred Stock Series A,NMS,USA
DCP,DCP Midstream  LP Common Units ,NYQ,USA
DCPH,Deciphera Pharmaceuticals Inc. Common Stock,NMS,USA
DCRC,Decarbonization Plus Acquisition Corporation III Class A Common Stock,NCM,USA
DCRCU,Decarbonization Plus Acquisition Corporation III Unit,NCM,USA
DCRCW,Decarbonization Plus Acquisition Corporation III Warrant,NCM,USA
DCRD,Decarbonization Plus Acquisition Corporation IV Class A Ordinary Share,NCM,USA
DCRDU,Decarbonization Plus Acquisition Corporation IV Unit,NCM,USA
DCRDW,Decarbonization Plus Acquisition Corporation IV Warrant,NGM,USA
DCRN,Decarbonization Plus Acquisition Corporation II Class A Common stock,NCM,USA
DCRNU,Decarbonization Plus Acquisition Corporation II Unit,NCM,USA
DCRNW,Decarbonization Plus Acquisition Corporation II Warrant,NCM,USA
DCT,Duck Creek Technologies Inc. Common Stock,NMS,USA
DCTH,Delcath Systems Inc. Common Stock,NCM,USA
DCUE,Dominion Energy Inc. 2019 Series A Corporate Units,NYQ,USA
DDD,3D Systems Corporation Common Stock,NYQ,USA
DDF,Delaware Investments Dividend & Income Fund Inc. Common Stock,NYQ,USA
DDOG,Datadog Inc. Class A Common Stock,NMS,USA
DDS,Dillard's Inc. Common Stock,NYQ,USA
DDT,Dillard's Capital Trust I,NYQ,USA
DE,Deere & Company Common Stock,NYQ,USA
DEA,Easterly Government Properties Inc. Common Stock,NYQ,USA
DECK,Deckers Outdoor Corporation Common Stock,NYQ,USA
DEI,Douglas Emmett Inc. Common Stock,NYQ,USA
DENN,Denny's Corporation Common Stock,NCM,USA
DEX,Delaware Enhanced Global Dividend Common Shares of Beneficial Interest,NYQ,USA
DFFN,Diffusion Pharmaceuticals Inc. Common Stock,NCM,USA
DFH,Dream Finders Homes Inc. Class A Common Stock,NMS,USA
DFPH,DFP Healthcare Acquisitions Corp. Class A Common Stock,NCM,USA
DFPHW,DFP Healthcare Acquisitions Corp. Warrant,NCM,USA
DFS,Discover Financial Services Common Stock,NYQ,USA
DG,Dollar General Corporation Common Stock,NYQ,USA
DGICA,Donegal Group Inc. Class A Common Stock,NMS,USA
DGICB,Donegal Group Inc. Class B Common Stock,NMS,USA
DGII,Digi International Inc. Common Stock,NMS,USA
DGLY,Digital Ally Inc. Common Stock,NCM,USA
DGNS,Dragoneer Growth Opportunities Corp. II Class A Ordinary Shares,NCM,USA
DGNU,Dragoneer Growth Opportunities Corp. III Class A Ordinary Shares,NCM,USA
DGX,Quest Diagnostics Incorporated Common Stock,NYQ,USA
DH,Definitive Healthcare Corp. Class A Common Stock,NMS,USA
DHBC,DHB Capital Corp. Class A common stock,NCM,USA
DHBCU,DHB Capital Corp. Unit,NCM,USA
DHBCW,DHB Capital Corp. Warrant,NCM,USA
DHC,Diversified Healthcare Trust Common Shares of Beneficial Interest,NMS,USA
DHCA,DHC Acquisition Corp. Class A ordinary share,NCM,USA
DHCAU,DHC Acquisition Corp. Unit,NCM,USA
DHCAW,DHC Acquisition Corp. Warrant,NCM,USA
DHCNI,Diversified Healthcare Trust 5.625% Senior Notes due 2042,NMS,USA
DHCNL,Diversified Healthcare Trust 6.25% Senior Notes Due 2046,NMS,USA
DHF,BNY Mellon High Yield Strategies Fund Common Stock,NYQ,USA
DHHC,DiamondHead Holdings Corp. Class A Common Stock,NCM,USA
DHHCU,DiamondHead Holdings Corp. Unit,NCM,USA
DHHCW,DiamondHead Holdings Corp. Warrant,NCM,USA
DHI,D.R. Horton Inc. Common Stock,NYQ,USA
DHIL,Diamond Hill Investment Group Inc. Class A Common Stock,NMS,USA
DHR,Danaher Corporation Common Stock,NYQ,USA
DHX,DHI Group Inc. Common Stock,NYQ,USA
MER^K,Bank of America Corporation Income Capital Obligation Notes initially due December 15 2066,,USA
DHY,Credit Suisse High Yield Bond Fund Common Stock,NYQ,USA
DIBS,1stdibs.com Inc. Common Stock,NGM,USA
MET^A,MetLife Inc. Preferred Series A Floating Rate,,USA
MET^E,MetLife Inc. Depositary shares each representing a 1/1000th interest in a share of the Issuera??s 5.625% Non-Cumulative Preferred Stock Series E.,,USA
MET^F,MetLife Inc. Depositary Shares each representing a 1/1000th interest in a share of 4.75% Non-Cumulative Preferred Stock Series F,,USA
DICE,DICE Therapeutics Inc. Common Stock,NGM,USA
DIN,Dine Brands Global Inc. Common Stock,NYQ,USA
DIOD,Diodes Incorporated Common Stock,NMS,USA
DIS,Walt Disney Company (The) Common Stock,NYQ,USA
MFA^B,MFA Financial Inc. Preferred Series B,,USA
MFA^C,MFA Financial Inc. 6.50% Series C Fixed-to-Floating Rate Cumulative Redeemable Preferred Stock,,USA
DISA,Disruptive Acquisition Corporation I Class A Ordinary Shares,NCM,USA
DISAU,Disruptive Acquisition Corporation I Unit,NCM,USA
DISAW,Disruptive Acquisition Corporation I Warrant,NCM,USA
DISCA,Discovery Inc. Series A Common Stock,NMS,USA
DISCB,Discovery Inc. Series B Common Stock,NMS,USA
DISCK,Discovery Inc. Series C Common Stock,NMS,USA
DISH,DISH Network Corporation Class A Common Stock,NMS,USA
DIT,AMCON Distributing Company Common Stock,ASE,USA
DJCO,Daily Journal Corp. (S.C.) Common Stock,NCM,USA
DK,Delek US Holdings Inc. Common Stock,NYQ,USA
DKL,Delek Logistics Partners L.P. Common Units representing Limited Partner Interests,NYQ,USA
DKNG,DraftKings Inc. Class A Common Stock,NMS,USA
DKS,Dick's Sporting Goods Inc Common Stock,NYQ,USA
DLA,Delta Apparel Inc. Common Stock,ASE,USA
DLB,Dolby Laboratories Common Stock,NYQ,USA
DLCA,Deep Lake Capital Acquisition Corp. Class A Ordinary Shares,NCM,USA
DLCAU,Deep Lake Capital Acquisition Corp. Unit,NCM,USA
DLCAW,Deep Lake Capital Acquisition Corp. Warrant,NCM,USA
DLHC,DLH Holdings Corp.,NCM,USA
DLPN,Dolphin Entertainment Inc. Common Stock,NCM,USA
DLR,Digital Realty Trust Inc. Common Stock,NYQ,USA
DLTH,Duluth Holdings Inc. Class B Common Stock,NMS,USA
DLTR,Dollar Tree Inc. Common Stock,NMS,USA
DLX,Deluxe Corporation Common Stock,NYQ,USA
DMAC,DiaMedica Therapeutics Inc. Common Stock,NCM,USA
DMAQU,Deep Medicine Acquisition Corp. Unit,NGM,USA
DMF,BNY Mellon Municipal Income Inc. Common Stock,NYQ,USA
DMLP,Dorchester Minerals L.P. Common Units Representing Limited Partnership Interests,NMS,USA
DMO,Western Asset Mortgage Opportunity Fund Inc. Common Stock,NYQ,USA
DMRC,Digimarc Corporation Common Stock,NMS,USA
DMS,Digital Media Solutions Inc. Class A Ordinary Shares,NYQ,USA
DMTK,DermTech Inc. Common Stock,NCM,USA
DNA,Ginkgo Bioworks Holdings Inc. Class A Common Stock,NYQ,USA
DNAA,Social Capital Suvretta Holdings Corp. I Class A Ordinary Share,NCM,USA
DNAB,Social Capital Suvretta Holdings Corp. II Class A Ordinary Shares,NCM,USA
DNAC,Social Capital Suvretta Holdings Corp. III Class A ordinary shares,NCM,USA
DNAD,Social Capital Suvretta Holdings Corp. IV Class A Ordinary Shares,NCM,USA
DNAY,Codex DNA Inc. Common Stock,NMS,USA
DNB,Dun & Bradstreet Holdings Inc. Common Stock,NYQ,USA
DNLI,Denali Therapeutics Inc. Common Stock,NMS,USA
DNP,DNP Select Income Fund Inc. Common Stock,NYQ,USA
DNUT,Krispy Kreme Inc. Common Stock,NMS,USA
DOC,Physicians Realty Trust Common Shares of Beneficial Interest,NYQ,USA
DOCU,DocuSign Inc. Common Stock,NMS,USA
DOMO,Domo Inc. Class B Common Stock,NGM,USA
DORM,Dorman Products Inc. Common Stock,NMS,USA
DOV,Dover Corporation Common Stock,NYQ,USA
DPG,Duff & Phelps Utility and Infrastructure Fund Inc.,NYQ,USA
DPW,Ault Global Holdings Inc. Common Stock,ASE,USA
MITT^A,AG Mortgage Investment Trust Inc. 8.25% Preferred Series A,,USA
MITT^B,AG Mortgage Investment Trust Inc. Preferred Series B,,USA
MITT^C,AG Mortgage Investment Trust Inc. 8.00% Series C Fixed-to-Floating Rate Cumulative Redeemable Preferred Stock $0.01 par value per share,,USA
DPZ,Domino's Pizza Inc Common Stock,NYQ,USA
DRAY,Macondray Capital Acquisition Corp. I Class A Ordinary Shares,NCM,USA
DRAYU,Macondray Capital Acquisition Corp. I Unit,NCM,USA
DRAYW,Macondray Capital Acquisition Corp. I Warrant,NCM,USA
DRE,Duke Realty Corporation Common Stock,NYQ,USA
DRH,Diamondrock Hospitality Company Common Stock,NYQ,USA
DRI,Darden Restaurants Inc. Common Stock,NYQ,USA
DRMA,Dermata Therapeutics Inc. Common Stock,NCM,USA
DRMAW,Dermata Therapeutics Inc. Warrant,NCM,USA
DRNA,Dicerna Pharmaceuticals Inc. Common Stock,NMS,USA
DRQ,Dril-Quip Inc. Common Stock,NYQ,USA
DRRX,DURECT Corporation Common Stock,NCM,USA
DRVN,Driven Brands Holdings Inc. Common Stock,NMS,USA
DS,Drive Shack Inc.,NYQ,USA
DSEY,Diversey Holdings Ltd. Ordinary Shares,NMS,USA
DSGN,Design Therapeutics Inc. Common Stock,NMS,USA
DSKE,Daseke Inc. Common Stock,NCM,USA
DSKEW,Daseke Inc. Warrant,NCM,USA
DSM,BNY Mellon Strategic Municipal Bond Fund Inc. Common Stock,NYQ,USA
DSP,Viant Technology Inc. Class A Common Stock,NMS,USA
DSPG,DSP Group Inc. Common Stock,NMS,USA
DSS,DSS Inc. Common Stock,ASE,USA
DSU,Blackrock Debt Strategies Fund Inc. Common Stock,NYQ,USA
DT,Dynatrace Inc. Common Stock,NYQ,USA
DTB,DTE Energy Company 2020 Series G 4.375% Junior Subordinated Debentures due 2080,NYQ,USA
DTE,DTE Energy Company Common Stock,NYQ,USA
DTF,DTF Tax-Free Income Inc. Common Stock,NYQ,USA
DTIL,Precision BioSciences Inc. Common Stock,NMS,USA
DTOC,Digital Transformation Opportunities Corp. Class A Common Stock,NCM,USA
DTOCU,Digital Transformation Opportunities Corp. Units,NCM,USA
DTOCW,Digital Transformation Opportunities Corp. Warrant,NCM,USA
DTP,DTE Energy Company 6.25% Corporate Units,NYQ,USA
DTRT,DTRT Health Acquisition Corp. Class A Common Stock,NCM,USA
DTRTU,DTRT Health Acquisition Corp. Unit,NCM,USA
DTRTW,DTRT Health Acquisition Corp. Warrant,NGM,USA
DTST,Data Storage Corporation Common Stock,NCM,USA
DTSTW,Data Storage Corporation Warrant,NCM,USA
MNR^C,Monmouth Real Estate Investment Corporation 6.125% Series C Cumulative Redeemable Preferred Stock,,USA
DTW,DTE Energy Company 2017 Series E 5.25% Junior Subordinated Debentures due 2077,NYQ,USA
DTY,DTE Energy Company 2016 Series F 6.00% Junior Subordinated Debentures due 2076,NYQ,USA
DUK,Duke Energy Corporation (Holding Company) Common Stock,NYQ,USA
DUKB,Duke Energy Corporation 5.625% Junior Subordinated Debentures due 2078,NYQ,USA
DUNE,Dune Acquisition Corporation Class A Common Stock,NCM,USA
DUNEU,Dune Acquisition Corporation Unit,NCM,USA
DUNEW,Dune Acquisition Corporation Warrant,NCM,USA
DUOL,Duolingo Inc. Class A Common Stock,NMS,USA
DUOT,Duos Technologies Group Inc. Common Stock,NCM,USA
DVA,DaVita Inc. Common Stock,NYQ,USA
DVAX,Dynavax Technologies Corporation Common Stock,NCM,USA
DVD,Dover Motorsports Inc. Common Stock,NYQ,USA
DVN,Devon Energy Corporation Common Stock,NYQ,USA
DWAC,Digital World Acquisition Corp. Class A Common Stock,NGM,USA
DWACU,Digital World Acquisition Corp. Units,NGM,USA
DWACW,Digital World Acquisition Corp. Warrants,NGM,USA
DWSN,Dawson Geophysical Company Common Stock,NMS,USA
DX,Dynex Capital Inc. Common Stock,NYQ,USA
DXCM,DexCom Inc. Common Stock,NMS,USA
DXLG,Destination XL Group Inc. Common Stock,NGM,USA
DXPE,DXP Enterprises Inc. Common Stock,NMS,USA
DXR,Daxor Corporation Common Stock,ASE,USA
DXYN,Dixie Group Inc. (The) Common Stock,NGM,USA
DY,Dycom Industries Inc. Common Stock,NYQ,USA
DYAI,Dyadic International Inc. Common Stock,NCM,USA
DYN,Dyne Therapeutics Inc. Common Stock,NMS,USA
DYNS,Dynamics Special Purpose Corp. Class A Common Stock,NCM,USA
DYNT,Dynatronics Corporation Common Stock,NCM,USA
DZSI,DZS Inc. Common Stock,NCM,USA
EA,Electronic Arts Inc. Common Stock,NMS,USA
EAC,Edify Acquisition Corp. Class A Common Stock,NCM,USA
EACPU,Edify Acquisition Corp. Units,NCM,USA
EACPW,Edify Acquisition Corp. Warrant,NCM,USA
EAD,Wells Fargo Income Opportunities Fund Common Shares,NYQ,USA
EAF,GrafTech International Ltd. Common Stock,NYQ,USA
EAI,Entergy Arkansas LLC First Mortgage Bonds 4.875% Series Due September 1 2066,NYQ,USA
EAR,Eargo Inc. Common Stock,NMS,USA
EARN,Ellington Residential Mortgage REIT Common Shares of Beneficial Interest,NYQ,USA
EAST,Eastside Distilling Inc. Common Stock,NCM,USA
EAT,Brinker International Inc. Common Stock,NYQ,USA
EB,Eventbrite Inc. Class A Common Stock,NYQ,USA
EBAY,eBay Inc. Common Stock,NMS,USA
EBC,Eastern Bankshares Inc. Common Stock,NMS,USA
EBET,Esports Technologies Inc. Common Stock,NCM,USA
EBF,Ennis Inc. Common Stock,NYQ,USA
EBIX,Ebix Inc. Common Stock,NMS,USA
EBMT,Eagle Bancorp Montana Inc. Common Stock,NGM,USA
EBS,Emergent Biosolutions Inc. Common Stock,NYQ,USA
EBSB,Meridian Bancorp Inc. Common Stock,NMS,USA
EBTC,Enterprise Bancorp Inc Common Stock,NMS,USA
ECC           ,Eagle Point Credit Company Inc. Common Stock,NYQ,USA
ECCB,Eagle Point Credit Company Inc. 7.75% Series B Term Preferred Stock due 2026,NYQ,USA
ECCC,Eagle Point Credit Company Inc. 6.50% Series C Term Preferred Stock due 2031,NYQ,USA
ECCW,Eagle Point Credit Company Inc. 6.75% Notes due 2031,NYQ,USA
ECCX,Eagle Point Credit Company Inc. 6.6875% Notes due 2028,NYQ,USA
ECCY,Eagle Point Credit Company Inc. 6.75% Notes due 2027,NYQ,USA
ECF,Ellsworth Growth and Income Fund Ltd.,NYQ,USA
MS^A,Morgan Stanley Dep Shs repstg 1/1000 Pfd Ser A,,USA
MS^E,Morgan Stanley DEPOSITARY SHARES REP 1/1000TH SHARES FIXED/FLTG PREFERRED STOCK SERIES E,,USA
MS^F,Morgan Stanley Dep Shs Rpstg 1/1000th Int Prd Ser F Fxd to Flag,,USA
MS^I,Morgan Stanley Depository Shares Representing 1/1000th Preferred Series 1 Fixed to Floating Non (Cum),,USA
MS^K,Morgan Stanley Depositary Shares each representing 1/1000th of a share of Fixed-to-Floating Rate Non-Cumulative Preferred Stock  Series K,,USA
MS^L,Morgan Stanley Depositary Shares each representing 1/1000th of a share of 4.875% Non-Cumulative Preferred Stock Series L,,USA
MS^O,Morgan Stanley Depositary Shares each representing 1/1000th of a share of 4.250% Non-Cumulative Preferred Stock Series O,,USA
ECHO,Echo Global Logistics Inc. Common Stock,NMS,USA
ECL,Ecolab Inc. Common Stock,NYQ,USA
ECOL,US Ecology Inc Common Stock,NMS,USA
ECOLW,US Ecology Inc. Warrant,NCM,USA
ECOM          ,ChannelAdvisor Corporation Common Stock,NYQ,USA
ECOR,electroCore Inc. Common Stock,NMS,USA
ECPG,Encore Capital Group Inc Common Stock,NMS,USA
ECVT,Ecovyst Inc. Common Stock,NYQ,USA
ED,Consolidated Edison Inc. Common Stock,NYQ,USA
EDD,Morgan Stanley Emerging Markets Domestic Debt Fund Inc. Morgan Stanley Emerging Markets Domestic Debt Fund Inc. Common Stock,NYQ,USA
EDF,Stone Harbor Emerging Markets Income Fund Common Shares of Beneficial Interest,NYQ,USA
EDI,Stone Harbor Emerging Markets Total Income Fund Common Shares of Beneficial Interests,NYQ,USA
EDIT,Editas Medicine Inc. Common Stock,NMS,USA
EDNCU,Endurance Acquisition Corp. Unit,NCM,USA
EDSA,Edesa Biotech Inc. Common Shares,NCM,USA
EDUC,Educational Development Corporation Common Stock,NGM,USA
EEA,The European Equity Fund Inc. Common Stock,NYQ,USA
EEFT,Euronet Worldwide Inc. Common Stock,NMS,USA
EEIQ,Elite Education Group International Ltd. Common Stock,NCM,USA
EEX,Emerald Holding Inc. Common Stock,NYQ,USA
EFC,Ellington Financial Inc. Common Stock ,NYQ,USA
EFL,Eaton Vance Floating-Rate 2022 Target Term Trust Common Shares of Beneficial Interest,NYQ,USA
EFOI,Energy Focus Inc. Common Stock,NCM,USA
EFR,Eaton Vance Senior Floating-Rate Fund Common Shares of Beneficial Interest,NYQ,USA
EFSC,Enterprise Financial Services Corporation Common Stock,NMS,USA
EFT,Eaton Vance Floating Rate Income Trust Common Shares of Beneficial Interest,NYQ,USA
EFTR,eFFECTOR Therapeutics Inc. Common Stock,NCM,USA
EFTRW,eFFECTOR Therapeutics Inc. Warrant,NGM,USA
EFX,Equifax Inc. Common Stock,NYQ,USA
EGAN,eGain Corporation Common Stock,NCM,USA
EGBN,Eagle Bancorp Inc. Common Stock,NCM,USA
EGF,Blackrock Enhanced Government Fund Inc. Common Stock,NYQ,USA
EGHT,8x8 Inc Common Stock,NYQ,USA
EGLE,Eagle Bulk Shipping Inc. Common Stock,NMS,USA
EGP,EastGroup Properties Inc. Common Stock,NYQ,USA
EGRX,Eagle Pharmaceuticals Inc. Common Stock,NGM,USA
EGY,VAALCO Energy Inc.  Common Stock,NYQ,USA
EHC,Encompass Health Corporation Common Stock,NYQ,USA
EHI,Western Asset Global High Income Fund Inc Common Stock,NYQ,USA
EHTH,eHealth Inc. Common Stock,NMS,USA
EIG,Employers Holdings Inc Common Stock,NYQ,USA
EIGR,Eiger BioPharmaceuticals Inc. Common Stock,NGM,USA
EIM,Eaton Vance Municipal Bond Fund Common Shares of Beneficial Interest $.01 par value,NYQ,USA
EIX,Edison International Common Stock,NYQ,USA
EJFA,EJF Acquisition Corp. Class A Ordinary Share,NCM,USA
EJFAU,EJF Acquisition Corp. Unit,NCM,USA
EJFAW,EJF Acquisition Corp. Warrant,NCM,USA
EKSO,Ekso Bionics Holdings Inc. Common Stock,NCM,USA
EL,Estee Lauder Companies Inc. (The) Common Stock,NYQ,USA
ELA,Envela Corporation Common Stock,ASE,USA
ELAN,Elanco Animal Health Incorporated Common Stock,NYQ,USA
ELAT,Elanco Animal Health Incorporated 5.00% Tangible Equity Units,NYQ,USA
ELC,Entergy Louisiana Inc. Collateral Trust Mortgage Bonds 4.875 % Series due September 1 2066,NYQ,USA
ELDN,Eledon Pharmaceuticals Inc. Common Stock,NCM,USA
ELEV,Elevation Oncology Inc. Common stock,NMS,USA
ELF,e.l.f. Beauty Inc. Common Stock,NYQ,USA
ELMD,Electromed Inc. Common Stock,ASE,USA
ELMS,Electric Last Mile Solutions Inc. Class A Common stock,NMS,USA
ELMSW,Electric Last Mile Solutions Inc. Warrant,NMS,USA
ELOX,Eloxx Pharmaceuticals Inc. Common Stock,NGM,USA
ELS,Equity Lifestyle Properties Inc. Common Stock,NYQ,USA
ELSE,Electro-Sensors Inc. Common Stock,NCM,USA
ELVT,Elevate Credit Inc. Common Stock,NYQ,USA
ELY,Callaway Golf Company Common Stock,NYQ,USA
ELYM,Eliem Therapeutics Inc Common Stock,NGM,USA
EMAN,eMagin Corporation Common Stock,ASE,USA
EMCF,Emclaire Financial Corp Common Stock,NCM,USA
EMD,Western Asset Emerging Markets Debt Fund Inc Common Stock,NYQ,USA
EME,EMCOR Group Inc. Common Stock,NYQ,USA
EMF,Templeton Emerging Markets Fund Common Stock,NYQ,USA
EMKR,EMCORE Corporation Common Stock,NGM,USA
EML,Eastern Company (The) Common Stock,NGM,USA
EMN,Eastman Chemical Company Common Stock,NYQ,USA
EMO,ClearBridge Energy Midstream Opportunity Fund Inc. Common Stock,NYQ,USA
EMP,Entergy Mississippi LLC First Mortgage Bonds 4.90% Series Due October 1 2066,NYQ,USA
EMR,Emerson Electric Company Common Stock,NYQ,USA
ENERU,Accretion Acquisition Corp. Unit,NGM,USA
ENFA,890 5th Avenue Partners Inc. Class A Common Stock,NCM,USA
ENFAU,890 5th Avenue Partners Inc. Unit,NCM,USA
ENFAW,890 5th Avenue Partners Inc. Warrant,NCM,USA
ENG,ENGlobal Corporation Common Stock,NCM,USA
ENJ,Entergy New Orleans LLC First Mortgage Bonds 5.0% Series due December 1 2052,NYQ,USA
ENJY,Enjoy Technology Inc. Common Stock,NGM,USA
ENJYW,Enjoy Technology Inc. Warrant,NGM,USA
ENNV,ECP Environmental Growth Opportunities Corp. Class A Common Stock,NCM,USA
ENNVU,ECP Environmental Growth Opportunities Corp. Unit,NCM,USA
ENNVW,ECP Environmental Growth Opportunities Corp. Warrants,NCM,USA
ENO,Entergy New Orleans LLC First Mortgage Bonds 5.50% Series due April 1 2066,NYQ,USA
ENOB,Enochian Biosciences Inc. Common Stock,NCM,USA
ENPH,Enphase Energy Inc. Common Stock,NGM,USA
ENR,Energizer Holdings Inc. Common Stock,NYQ,USA
