code,stock_name,exchange,country
A,Agilent Technologies Inc. Common Stock,NYQ,USA
AACIU,Armada Acquisition Corp. I Unit,NGM,USA
AADI,Aadi Bioscience Inc. Common Stock,NCM,USA
AAIC,Arlington Asset Investment Corp Class A (new),NYQ,USA
AAIN,Arlington Asset Investment Corp 6.000% Senior Notes Due 2026,NYQ,USA
AAL,American Airlines Group Inc. Common Stock,NMS,USA
AAMC,Altisource Asset Management Corp Com,ASE,USA
AAME,Atlantic American Corporation Common Stock,NGM,USA
AAN,Aarons Holdings Company Inc. Common Stock ,NYQ,USA
AAOI,Applied Optoelectronics Inc. Common Stock,NGM,USA
AAON,AAON Inc. Common Stock,NMS,USA
AAP,Advance Auto Parts Inc.,NYQ,USA
AAPL,Apple Inc. Common Stock,NMS,USA
AAT,American Assets Trust Inc. Common Stock,NYQ,USA
AATC,Autoscope Technologies Corporation Common Stock,NCM,USA
AAWW,Atlas Air Worldwide Holdings NEW Common Stock,NMS,USA
AB,AllianceBernstein Holding L.P.  Units,NYQ,USA
ABBV,AbbVie Inc. Common Stock,NYQ,USA
ABC,AmerisourceBergen Corporation Common Stock,NYQ,USA
ABCB,Ameris Bancorp Common Stock,NMS,USA
ABEO,Abeona Therapeutics Inc. Common Stock,NCM,USA
ABG,Asbury Automotive Group Inc Common Stock,NYQ,USA
ABGI,ABG Acquisition Corp. I Class A Ordinary Shares,NCM,USA
ABIO,ARCA biopharma Inc. Common Stock,NCM,USA
ABM,ABM Industries Incorporated Common Stock,NYQ,USA
ABMD,ABIOMED Inc. Common Stock,NMS,USA
ABNB,Airbnb Inc. Class A Common Stock,NMS,USA
ABOS,Acumen Pharmaceuticals Inc. Common Stock,NMS,USA
ABR,Arbor Realty Trust Common Stock,NYQ,USA
ABSI,Absci Corporation Common Stock,NMS,USA
ABT,Abbott Laboratories Common Stock,NYQ,USA
ABTX,Allegiance Bancshares Inc. Common Stock,NGM,USA
ABVC,ABVC Biopharma Inc. Common Stock,NCM,USA
AC,Associated Capital Group Inc. Common Stock,NYQ,USA
ACAD,ACADIA Pharmaceuticals Inc. Common Stock,NMS,USA
ACAH,Atlantic Coastal Acquisition Corp. Class A Common Stock,NCM,USA
ACAHU,Atlantic Coastal Acquisition Corp. Unit,NCM,USA
ACAHW,Atlantic Coastal Acquisition Corp. Warrant,NCM,USA
ACBI,Atlantic Capital Bancshares Inc. Common Stock,NMS,USA
ACC,American Campus Communities Inc Common Stock,NYQ,USA
ACCD,Accolade Inc. Common Stock,NMS,USA
ACCO,Acco Brands Corporation Common Stock,NYQ,USA
ACEL,Accel Entertainment Inc. ,NYQ,USA
ACER,Acer Therapeutics Inc. Common Stock (DE),NCM,USA
ACET,Adicet Bio Inc. Common Stock ,NGM,USA
ACEV,ACE Convergence Acquisition Corp. Class A Ordinary Shares,NCM,USA
ACEVU,ACE Convergence Acquisition Corp. Unit,NCM,USA
ACEVW,ACE Convergence Acquisition Corp. Warrant,NCM,USA
ACHC,Acadia Healthcare Company Inc. Common Stock,NMS,USA
ACHR,Archer Aviation Inc. Class A Common Stock,NYQ,USA
ACHV,Achieve Life Sciences Inc. Common Shares,NCM,USA
ACI,Albertsons Companies Inc. Class A Common Stock,NYQ,USA
ACIW,ACI Worldwide Inc. Common Stock,NMS,USA
ACKIT,Ackrell SPAC Partners I Co. Subunits,NCM,USA
ACKIU,Ackrell SPAC Partners I Co. Units,NCM,USA
ACKIW,Ackrell SPAC Partners I Co. Warrants,NCM,USA
ACLS,Axcelis Technologies Inc. Common Stock,NMS,USA
ACM,AECOM Common Stock,NYQ,USA
ACMR,ACM Research Inc. Class A Common Stock,NGM,USA
ACNB,ACNB Corporation Common Stock,NCM,USA
ACOR,Acorda Therapeutics Inc. Common Stock,NMS,USA
ACP,Aberdeen Income Credit Strategies Fund Common Shares,NYQ,USA
ACQR,Independence Holdings Corp. Class A Ordinary Share,NCM,USA
ACQRU,Independence Holdings Corp. Units,NCM,USA
FHN^B,First Horizon Corporation Depositary Shares each representing a 1/400th interest in a share of Non-Cumulative Perpetual Preferred Stock Series B,,USA
FHN^C,First Horizon Corporation Depositary Shares each representing a 1/400th interest in a share of Non-Cumulative Perpetual Preferred Stock Series C,,USA
FHN^D,First Horizon Corporation Depositary Shares each representing a 1/400th interest in a share of Non-Cumulative Perpetual Preferred Stock Series D,,USA
FHN^E,First Horizon Corporation Depositary Shares each representing a 1/4000th interest in a share of Non-Cumulative Perpetual Preferred Stock Series E,,USA
FHN^F,First Horizon Corporation Depositary Shares each representing 1/4000th Interest in a Share of Non-Cumulative Perpetual Preferred Stock Series F,,USA
ACQRW,Independence Holdings Corp. Warrant,NCM,USA
ACR,ACRES Commercial Realty Corp. Common Stock,NYQ,USA
ACRE,Ares Commercial Real Estate Corporation Common Stock,NYQ,USA
ACRS,Aclaris Therapeutics Inc. Common Stock,NMS,USA
ACRX,AcelRx Pharmaceuticals Inc. Common Stock,NGM,USA
ACT,Enact Holdings Inc. Common Stock,NMS,USA
ACTD,ArcLight Clean Transition Corp. II Class A Ordinary Share,NCM,USA
ACTDU,ArcLight Clean Transition Corp. II Unit,NCM,USA
ACTDW,ArcLight Clean Transition Corp. II Warrant,NCM,USA
ACTG,Acacia Research Corporation (Acacia Tech) Common Stock,NMS,USA
ACU,Acme United Corporation. Common Stock,ASE,USA
ACV,Virtus AllianzGI Diversified Income & Convertible Fund Common Shares of Beneficial Interest,NYQ,USA
ACVA,ACV Auctions Inc. Class A Common Stock,NMS,USA
ACXP,Acurx Pharmaceuticals Inc. Common Stock,NCM,USA
ACY,AeroCentury Corp. Common Stock,ASE,USA
ADALU,Anthemis Digital Acquisitions I Corp Unit,NGM,USA
ADBE,Adobe Inc. Common Stock,NMS,USA
ADC,Agree Realty Corporation Common Stock,NYQ,USA
ADER,26 Capital Acquisition Corp. Class A Common Stock,NCM,USA
ADERU,26 Capital Acquisition Corp. Unit,NCM,USA
ADERW,26 Capital Acquisition Corp. Warrant,NCM,USA
ADES,Advanced Emissions Solutions Inc. Common Stock,NGM,USA
ADGI,Adagio Therapeutics Inc. Common Stock,NGM,USA
ADI,Analog Devices Inc. Common Stock,NMS,USA
ADIL,Adial Pharmaceuticals Inc Common Stock,NCM,USA
ADILW,Adial Pharmaceuticals Inc Warrant,NCM,USA
ADM,Archer-Daniels-Midland Company Common Stock,NYQ,USA
ADMA,ADMA Biologics Inc Common Stock,NGM,USA
ADMP,Adamis Pharmaceuticals Corporation Common Stock,NCM,USA
ADMS,Adamas Pharmaceuticals Inc. Common Stock,NGM,USA
ADN,Advent Technologies Holdings Inc. Class A Common Stock,NCM,USA
ADNWW,Advent Technologies Holdings Inc. Warrant,NCM,USA
ADOC,Edoc Acquisition Corp. Class A Ordinary Share,NCM,USA
ADOCR,Edoc Acquisition Corp. Right,NCM,USA
ADOCW,Edoc Acquisition Corp. Warrant,NCM,USA
ADP,Automatic Data Processing Inc. Common Stock,NMS,USA
ADPT,Adaptive Biotechnologies Corporation Common Stock,NMS,USA
ADRA,Adara Acquisition Corp. Class A Common Stock,ASE,USA
ADS,Alliance Data Systems Corporation Common Stock,NYQ,USA
ADSK,Autodesk Inc. Common Stock,NMS,USA
ADT,ADT Inc. Common Stock,NYQ,USA
ADTN,ADTRAN Inc. Common Stock,NMS,USA
ADTX,Aditxt Inc. Common Stock,NCM,USA
ADUS,Addus HomeCare Corporation Common Stock,NMS,USA
ADV,Advantage Solutions Inc. Class A Common Stock,NMS,USA
ADVM,Adverum Biotechnologies Inc. Common Stock,NGM,USA
ADVWW,Advantage Solutions Inc. Warrant,NMS,USA
ADX,Adams Diversified Equity Fund Inc.,NYQ,USA
ADXS,Advaxis Inc. Common Stock,NCM,USA
AE,Adams Resources & Energy Inc. Common Stock,ASE,USA
AEAC,Authentic Equity Acquisition Corp. Class A ordinary share,NCM,USA
AEACU,Authentic Equity Acquisition Corp. Unit,NCM,USA
AEACW,Authentic Equity Acquisition Corp. Warrant,NCM,USA
AEAEU,AltEnergy Acquisition Corp. Unit,NGM,USA
AEE,Ameren Corporation Common Stock,NYQ,USA
AEF,Aberdeen Emerging Markets Equity Income Fund Inc. Common Stock,NYQ,USA
AEHAU,Aesther Healthcare Acquisition Corp Units,NGM,USA
AEHR,Aehr Test Systems Common Stock,NCM,USA
AEI,Alset EHome International Inc. Common Stock,NCM,USA
AEIS,Advanced Energy Industries Inc. Common Stock,NMS,USA
AEL,American Equity Investment Life Holding Company Common Stock,NYQ,USA
AEMD,Aethlon Medical Inc. Common Stock,NCM,USA
AEO,American Eagle Outfitters Inc. Common Stock,NYQ,USA
AEP,American Electric Power Company Inc. Common Stock,NMS,USA
FNB^E,F.N.B. Corporation Depositary Shares each representing a 1/40th interest in a share of Fixed-to-Floating Rate Non-Cumulative Perpetual Preferred  Stock Series E,,USA
AEPPL,American Electric Power Company Inc. Corporate Unit,NMS,USA
AEPPZ,American Electric Power Company Inc. Corporate Units,NMS,USA
AERI,Aerie Pharmaceuticals Inc. Common Stock,NGM,USA
AES,The AES Corporation Common Stock,NYQ,USA
AESC,The AES Corporation Corporate Units,NYQ,USA
AESE,Allied Esports Entertainment Inc. Common Stock,NCM,USA
AEY,ADDvantage Technologies Group Inc. Common Stock,NGM,USA
AEYE,AudioEye Inc. Common Stock,NCM,USA
AFAQ,AF Acquisition Corp. Class A Common Stock,NCM,USA
AFAQU,AF Acquisition Corp. Units,NCM,USA
AFAQW,AF Acquisition Corp. Warrants,NCM,USA
AFB,AllianceBernstein National Municipal Income Fund Inc,NYQ,USA
AFBI,Affinity Bancshares Inc. Common Stock (MD),NCM,USA
AFCG,AFC Gamma Inc. Common Stock,NGM,USA
AFG,American Financial Group Inc. Common Stock,NYQ,USA
AFGB,American Financial Group Inc. 5.875% Subordinated Debentures due 2059,NYQ,USA
AFGC,American Financial Group Inc. 5.125% Subordinated Debentures due 2059,NYQ,USA
AFGD,American Financial Group Inc. 5.625% Subordinated Debentures due 2060,NYQ,USA
AFGE,American Financial Group Inc. 4.500% Subordinated Debentures due 2060,NYQ,USA
AFIB,Acutus Medical Inc. Common Stock,NMS,USA
AFIN,American Finance Trust Inc. Class A Common Stock,NMS,USA
AFINO,American Finance Trust Inc. 7.375% Series C Cumulative Redeemable Preferred Stock,NMS,USA
AFINP,American Finance Trust Inc. 7.50% Series A Cumulative Redeemable Perpetual Preferred Stock,NMS,USA
AFL,AFLAC Incorporated Common Stock,NYQ,USA
AFRM,Affirm Holdings Inc. Class A Common Stock,NMS,USA
AGC,Altimeter Growth Corp. Class A Ordinary Shares,NCM,USA
AGCO,AGCO Corporation Common Stock,NYQ,USA
AGCUU,Altimeter Growth Corp. Unit,NCM,USA
AGCWW,Altimeter Growth Corp. Warrant,NCM,USA
AGD,Aberdeen Global Dynamic Dividend Fund,NYQ,USA
AGEN,Agenus Inc. Common Stock,NCM,USA
AGFS,AgroFresh Solutions Inc. Common Stock,NMS,USA
AGFY,Agrify Corporation Common Stock,NCM,USA
AGGR,Agile Growth Corp. Class A Ordinary Share,NCM,USA
AGGRU,Agile Growth Corp. Units,NCM,USA
AGGRW,Agile Growth Corp. Warrant.,NCM,USA
AGIL,AgileThought Inc. Class A Common Stock,NCM,USA
AGILW,AgileThought Inc. Warrant,NCM,USA
FRC^H,FIRST REPUBLIC BANK Depositary Shares each representing a 1/40th interest in a share of 5.125% Noncumulative Perpetual Series H Preferred Stock par value $0.01 per share,,USA
FRC^I,FIRST REPUBLIC BANK Depositary Shares each representing a 1/40th interest in a share of 5.50% Noncumulative Perpetual Series I Preferred Stock par value $0.01 per share,,USA
FRC^J,FIRST REPUBLIC BANK Depositary Shares Each Representing a 1/40th Interest in a Share of 4.70% Noncumulative Perpetual Series J Preferred Stock,,USA
FRC^K,FIRST REPUBLIC BANK Depositary Shares Each Representing a 1/40th Interest in a Share of 4.125% Noncumulative Perpetual Series K Preferred Stock,,USA
FRC^L,FIRST REPUBLIC BANK Depositary Shares Each Representing a 1/40th Interest in a Share of 4.250% Noncumulative Perpetual Series L Preferred Stock,,USA
FRC^M,FIRST REPUBLIC BANK Depositary Shares each representing a 1/40th interest in a share of 4.000% Noncumulative Perpetual Series M Preferred Stock,,USA
AGIO,Agios Pharmaceuticals Inc. Common Stock,NMS,USA
AGLE,Aeglea BioTherapeutics Inc. Common Stock,NGM,USA
AGM,Federal Agricultural Mortgage Corporation Common Stock,NYQ,USA
AGNC,AGNC Investment Corp. Common Stock,NMS,USA
AGNCM,AGNC Investment Corp. Depositary Shares rep 6.875% Series D Fixed-to-Floating Cumulative Redeemable Preferred Stock,NMS,USA
AGNCN,AGNC Investment Corp. Depositary Shares Each Representing a 1/1000th Interest in a Share of 7.00% Series C Fixed-To-Floating Rate Cumulative Redeemable Preferred Stock,NMS,USA
AGNCO,AGNC Investment Corp. Depositary Shares each representing a 1/1000th interest in a share of 6.50% Series E Fixed-to-Floating Cumulative Redeemable Preferred Stock,NMS,USA
AGNCP,AGNC Investment Corp. Depositary Shares Each Representing a 1/1000th Interest in a Share of 6.125% Series F Fixed-to-Floating Rate Cumulative Redeemable Preferred Stock,NMS,USA
AGR,Avangrid Inc. Common Stock,NYQ,USA
AGRX,Agile Therapeutics Inc. Common Stock,NCM,USA
AGS,PlayAGS Inc. Common Stock,NYQ,USA
AGTC,Applied Genetic Technologies Corporation Common Stock,NGM,USA
AGX,Argan Inc. Common Stock,NYQ,USA
AGYS,Agilysys Inc. Common Stock,NMS,USA
AHCO,AdaptHealth Corp. Common Stock,NCM,USA
AHH,Armada Hoffler Properties Inc. Common Stock,NYQ,USA
AHPA,Avista Public Acquisition Corp. II Class A Ordinary Shares,NCM,USA
AHPAU,Avista Public Acquisition Corp. II Unit,NCM,USA
AHPAW,Avista Public Acquisition Corp. II Warrant,NCM,USA
AHPI,Allied Healthcare Products Inc. Common Stock,NCM,USA
FRT^C,Federal Realty Investment Trust Depositary Shares each representing a 1/1000th interest in a 5.000% Series C Cumulative Redeemable Preferred Share,,USA
AHT,Ashford Hospitality Trust Inc Common Stock,NYQ,USA
AIC,Arlington Asset Investment Corp 6.750% Notes due 2025,NYQ,USA
AIG,American International Group Inc. New Common Stock,NYQ,USA
AIKI,AIkido Pharma Inc. Common Stock,NCM,USA
AIM,AIM ImmunoTech Inc. Common Stock,ASE,USA
AIMC,Altra Industrial Motion Corp. Common Stock,NMS,USA
AIN,Albany International Corporation Common Stock,NYQ,USA
AINC,Ashford Inc. (Holding Company) Common Stock,ASE,USA
AINV,Apollo Investment Corporation Common Stock,NGM,USA
AIP,Arteris Inc. Common Stock,NGM,USA
AIR,AAR Corp. Common Stock,NYQ,USA
AIRG,Airgain Inc. Common Stock,NCM,USA
AIRI,Air Industries Group Common Stock,ASE,USA
AIRS,AirSculpt Technologies Inc. Common Stock,NGM,USA
AIRT,Air T Inc. Common Stock,NGM,USA
AIRTP,Air T Inc. Air T Funding Alpha Income Trust Preferred Securities,NGM,USA
AIT,Applied Industrial Technologies Inc. Common Stock,NYQ,USA
AIV,Apartment Investment and Management Company Common Stock,NYQ,USA
AIZ,Assurant Inc. Common Stock,NYQ,USA
AIZN,Assurant Inc. 5.25% Subordinated Notes due 2061,NYQ,USA
AJG,Arthur J. Gallagher & Co. Common Stock,NYQ,USA
AJRD,Aerojet Rocketdyne Holdings Inc. Common Stock,NYQ,USA
AJX,Great Ajax Corp. Common Stock,NYQ,USA
AJXA,Great Ajax Corp. 7.25% Convertible Senior Notes due 2024,NYQ,USA
AKAM,Akamai Technologies Inc. Common Stock,NMS,USA
AKBA,Akebia Therapeutics Inc. Common Stock,NGM,USA
FTAI^A,Fortress Transportation and Infrastructure Investors LLC 8.25% Fixed to Floating Rate Series A Cumulative Perpetual Redeemable Preferred Shares,,USA
FTAI^B,Fortress Transportation and Infrastructure Investors LLC 8.00% Fixed-to-Floating Rate Series B Cumulative Perpetual Redeemable Preferred Shares,,USA
FTAI^C,Fortress Transportation and Infrastructure Investors LLC 8.25% Fixed - Rate Reset Series C Cumulative Perpetual Redeemable Preferred Shares,,USA
AKIC,Sports Ventures Acquisition Corp. Class A Ordinary Shares,NCM,USA
AKICU,Sports Ventures Acquisition Corp. Unit,NCM,USA
AKICW,Sports Ventures Acquisition Corp. Warrant,NCM,USA
AKR,Acadia Realty Trust Common Stock,NYQ,USA
AKRO,Akero Therapeutics Inc. Common Stock,NMS,USA
AKTS,Akoustis Technologies Inc. Common Stock,NCM,USA
AKUS,Akouos Inc. Common Stock,NMS,USA
AKYA,Akoya BioSciences Inc. Common Stock,NMS,USA
AL,Air Lease Corporation Class A Common Stock,NYQ,USA
ALB,Albemarle Corporation Common Stock,NYQ,USA
ALBO,Albireo Pharma Inc. Common Stock,NCM,USA
ALCO,Alico Inc. Common Stock,NMS,USA
ALDX,Aldeyra Therapeutics Inc. Common Stock,NCM,USA
ALE,Allete Inc.,NYQ,USA
ALEC,Alector Inc. Common Stock,NMS,USA
ALEX,Alexander & Baldwin Inc. Common Stock REIT Holding Company,NYQ,USA
ALF,ALFI Inc. Common Stock,NCM,USA
ALFIW,ALFI Inc. Warrant,NCM,USA
ALG,Alamo Group Inc. Common Stock,NYQ,USA
ALGM,Allegro MicroSystems Inc. Common Stock,NMS,USA
ALGN,Align Technology Inc. Common Stock,NMS,USA
ALGS,Aligos Therapeutics Inc. Common Stock,NMS,USA
ALGT,Allegiant Travel Company Common Stock,NMS,USA
ALHC,Alignment Healthcare Inc. Common Stock,NMS,USA
ALIM,Alimera Sciences Inc. Common Stock,NGM,USA
ALJJ,ALJ Regional Holdings Inc. Common Stock,NGM,USA
ALK,Alaska Air Group Inc. Common Stock,NYQ,USA
ALKT,Alkami Technology Inc. Common Stock,NMS,USA
ALL,Allstate Corporation (The) Common Stock,NYQ,USA
ALLE,Allegion plc Ordinary Shares,NYQ,USA
ALLK,Allakos Inc. Common Stock,NMS,USA
ALLO,Allogene Therapeutics Inc. Common Stock,NMS,USA
ALLY,Ally Financial Inc. Common Stock,NYQ,USA
ALNA,Allena Pharmaceuticals Inc. Common Stock,NMS,USA
ALNY,Alnylam Pharmaceuticals Inc. Common Stock,NMS,USA
ALOT,AstroNova Inc. Common Stock,NGM,USA
ALPA,Alpha Healthcare Acquisition Corp. III Class A Common Stock,NCM,USA
ALPAU,Alpha Healthcare Acquisition Corp. III Units,NCM,USA
ALPAW,Alpha Healthcare Acquisition Corp. III Warrant,NCM,USA
GAB^G,Gabelli Equity Trust Inc. (The) Series G Cumulative Preferred Stock,,USA
GAB^H,Gabelli Equity Trust Inc. (The) Pfd Ser H,,USA
GAB^J,Gabelli Equity Trust Inc. (The) 5.45% Series J Cumulative Preferred Stock,,USA
GAB^K,Gabelli Equity Trust Inc. (The) 5.00% Series K Cumulative Preferred Stock,,USA
ALPN,Alpine Immune Sciences Inc. Common Stock,NGM,USA
ALPP,Alpine 4 Holdings Inc. Class A Common Stock,NCM,USA
ALRM,Alarm.com Holdings Inc. Common Stock,NMS,USA
ALRN,Aileron Therapeutics Inc. Common Stock,NCM,USA
ALRS,Alerus Financial Corporation Common Stock,NCM,USA
ALSN,Allison Transmission Holdings Inc. Common Stock,NYQ,USA
ALT,Altimmune Inc. Common Stock,NGM,USA
ALTM,Altus Midstream Company Class A Common Stock,NGM,USA
ALTO,Alto Ingredients Inc. Common Stock,NCM,USA
ALTR,Altair Engineering Inc. Class A Common Stock,NMS,USA
GAM^B,General American Investors Company Inc. Cumulative Preferred Stock,,USA
ALTU,Altitude Acquisition Corp. Class A Common Stock,NCM,USA
ALTUU,Altitude Acquisition Corp. Unit,NCM,USA
ALTUW,Altitude Acquisition Corp. Warrant,NCM,USA
ALVR,AlloVir Inc. Common Stock,NMS,USA
ALX,Alexander's Inc. Common Stock,NYQ,USA
ALXO,ALX Oncology Holdings Inc. Common Stock,NMS,USA
ALZN,Alzamend Neuro Inc. Common Stock,NCM,USA
AM,Antero Midstream Corporation Common Stock,NYQ,USA
AMAL,Amalgamated Financial Corp. Common Stock (DE),NGM,USA
AMAO,American Acquisition Opportunity Inc. Class A Common Stock,NCM,USA
AMAOU,American Acquisition Opportunity Inc. Units,NCM,USA
AMAOW,American Acquisition Opportunity Inc. Warrant,NCM,USA
AMAT,Applied Materials Inc. Common Stock,NMS,USA
AMBA,Ambarella Inc. Ordinary Shares,NMS,USA
AMBC,Ambac Financial Group Inc. Common Stock,NYQ,USA
AMCI,AMCI Acquisition Corp. II Class A Common Stock,NCM,USA
AMCIU,AMCI Acquisition Corp. II Units,NCM,USA
AMCIW,AMCI Acquisition Corp. II Warrant,NCM,USA
AMCX,AMC Networks Inc. Class A Common Stock,NMS,USA
AMD,Advanced Micro Devices Inc. Common Stock,NMS,USA
AME,AMETEK Inc.,NYQ,USA
AMED,Amedisys Inc Common Stock,NMS,USA
AMEH,Apollo Medical Holdings Inc. Common Stock,NCM,USA
AMG,Affiliated Managers Group Inc. Common Stock,NYQ,USA
AMGN,Amgen Inc. Common Stock,NMS,USA
AMK,AssetMark Financial Holdings Inc. Common Stock,NYQ,USA
AMKR,Amkor Technology Inc. Common Stock,NMS,USA
AMN,AMN Healthcare Services Inc AMN Healthcare Services Inc,NYQ,USA
AMNB,American National Bankshares Inc. Common Stock,NMS,USA
AMOT,Allied Motion Technologies Inc.,NGM,USA
AMP,Ameriprise Financial Inc. Common Stock,NYQ,USA
AMPE,Ampio Pharmaceuticals Inc.,ASE,USA
AMPG,Amplitech Group Inc. Common Stock,NCM,USA
AMPGW,Amplitech Group Inc. Warrants,NCM,USA
AMPH,Amphastar Pharmaceuticals Inc. Common Stock,NMS,USA
GDV^G,Gabelli Dividend 5.25% Series G Cumulative Preferred Shares par value $0.001 per share,,USA
GDV^H,The Gabelli Dividend & Income Trust 5.375% Series H Cumulative Preferred Shares,,USA
GDV^K,The Gabelli Dividend & Income Trust 4.250% Series K Cumulative Preferred Shares,,USA
AMR,Alpha Metallurgical Resources Inc. Common Stock,NYQ,USA
AMRC,Ameresco Inc. Class A Common Stock,NYQ,USA
AMRK,A-Mark Precious Metals Inc. Common Stock,NMS,USA
AMRS,Amyris Inc. Common Stock,NMS,USA
AMS,American Shared Hospital Services Common Stock,ASE,USA
AMSC,American Superconductor Corporation Common Stock,NMS,USA
AMSF,AMERISAFE Inc. Common Stock,NMS,USA
AMST,Amesite Inc. Common Stock,NCM,USA
AMSWA,American Software Inc. Class A Common Stock,NMS,USA
AMT,American Tower Corporation (REIT) Common Stock,NYQ,USA
AMTB,Amerant Bancorp Inc. Class A Common Stock,NMS,USA
AMTBB,Amerant Bancorp Inc. Class B Common Stock,NMS,USA
AMTI,Applied Molecular Transport Inc. Common Stock,NMS,USA
AMTX,Aemetis Inc. Common Stock,NGM,USA
AMWD,American Woodmark Corporation Common Stock,NMS,USA
AMWL,American Well Corporation Class A Common Stock,NYQ,USA
AMZN,Amazon.com Inc. Common Stock,NMS,USA
AN,AutoNation Inc. Common Stock,NYQ,USA
ANAB,AnaptysBio Inc. Common Stock,NMS,USA
ANAT,American National Group Inc. Common Stock,NMS,USA
ANDE,Andersons Inc. (The) Common Stock,NMS,USA
ANEB,Anebulo Pharmaceuticals Inc. Common Stock,NCM,USA
ANF,Abercrombie & Fitch Company Common Stock,NYQ,USA
ANGI,Angi Inc. Class A Common Stock,NMS,USA
ANGN,Angion Biomedica Corp. Common Stock,NMS,USA
ANGO,AngioDynamics Inc. Common Stock,NMS,USA
ANIK,Anika Therapeutics Inc. Common Stock,NMS,USA
GGN^B,GAMCO Global Gold Natural Reources & Income Trust 5.00% Series B Cumulative 25.00 Liquidation Preference,,USA
ANIP,ANI Pharmaceuticals Inc.,NGM,USA
ANIX,Anixa Biosciences Inc. Common Stock,NCM,USA
ANNX,Annexon Inc. Common Stock,NMS,USA
ANSS,ANSYS Inc. Common Stock,NMS,USA
GGT^E,Gabelli Multi-Media Trust Inc. (The) 5.125% Series E Cumulative Preferred Stock,,USA
GGT^G,Gabelli Multi-Media Trust Inc. (The) 5.125% Series G Cumulative Preferred Shares,,USA
ANTM,Anthem Inc. Common Stock,NYQ,USA
ANVS,Annovis Bio Inc. Common Stock,ASE,USA
ANZU,Anzu Special Acquisition Corp I Class A Common Stock,NCM,USA
ANZUU,Anzu Special Acquisition Corp I Units,NCM,USA
ANZUW,Anzu Special Acquisition Corp I Warrant,NCM,USA
AOD,Aberdeen Total Dynamic Dividend Fund Common Stock,NYQ,USA
AON,Aon plc Class A Ordinary Shares (Ireland),NYQ,USA
AOS,A.O. Smith Corporation Common Stock,NYQ,USA
AOUT,American Outdoor Brands Inc. Common Stock ,NMS,USA
AP,Ampco-Pittsburgh Corporation Common Stock,NYQ,USA
APA,APA Corporation Common Stock,NMS,USA
APAC,StoneBridge Acquisition Corporation Class A Ordinary Shares,NCM,USA
APACU,StoneBridge Acquisition Corporation Unit,NCM,USA
APACW,StoneBridge Acquisition Corporation Warrant,NCM,USA
APAM,Artisan Partners Asset Management Inc. Class A Common Stock,NYQ,USA
APD,Air Products and Chemicals Inc. Common Stock,NYQ,USA
APDN,Applied DNA Sciences Inc. Common Stock,NCM,USA
APEI,American Public Education Inc. Common Stock,NMS,USA
APEN,Apollo Endosurgery Inc. Common Stock,NGM,USA
APH,Amphenol Corporation Common Stock,NYQ,USA
APLE,Apple Hospitality REIT Inc. Common Shares,NYQ,USA
APLS,Apellis Pharmaceuticals Inc. Common Stock,NMS,USA
APLT,Applied Therapeutics Inc. Common Stock,NGM,USA
APMI,AxonPrime Infrastructure Acquisition Corporation Class A Common Stock,NCM,USA
APMIU,AxonPrime Infrastructure Acquisition Corporation Unit,NCM,USA
APMIW,AxonPrime Infrastructure Acquisition Corporation Warrants,NCM,USA
APO,Apollo Global Management Inc. Class A Common Stock,NYQ,USA
APOG,Apogee Enterprises Inc. Common Stock,NMS,USA
APP,Applovin Corporation Class A Common Stock,NMS,USA
APPF,AppFolio Inc. Class A Common Stock,NGM,USA
APPH,AppHarvest Inc. Common Stock,NMS,USA
APPHW,AppHarvest Inc. Warrants,NMS,USA
GL^D,Globe Life Inc. 4.25% Junior Subordinated Debentures due 2061,,USA
APPN,Appian Corporation Class A Common Stock,NGM,USA
APPS,Digital Turbine Inc. Common Stock,NCM,USA
APR,Apria Inc. Common Stock,NMS,USA
APRE,Aprea Therapeutics Inc. Common stock,NMS,USA
APRN,Blue Apron Holdings Inc. Class A Common Stock,NYQ,USA
APSG,Apollo Strategic Growth Capital Class A Ordinary Shares,NYQ,USA
APTM,Alpha Partners Technology Merger Corp. Class A Ordinary Shares,NCM,USA
APTMU,Alpha Partners Technology Merger Corp. Unit,NCM,USA
APTMW,Alpha Partners Technology Merger Corp. Warrant,NCM,USA
APTS,Preferred Apartment Communities Inc. Common Stock,NYQ,USA
APTX,Aptinyx Inc. Common Stock,NMS,USA
APVO,Aptevo Therapeutics Inc. Common Stock,NCM,USA
APYX,Apyx Medical Corporation Common Stock,NMS,USA
AQB,AquaBounty Technologies Inc. Common Stock,NCM,USA
AQMS,Aqua Metals Inc. Common Stock,NCM,USA
AQST,Aquestive Therapeutics Inc. Common Stock,NGM,USA
AQUA,Evoqua Water Technologies Corp. Common Stock,NYQ,USA
GLP^A,Global Partners LP 9.75% Series A Fixed-to-Floating Rate Cumulative Redeemable Perpetual Preferred Units representing limited partner interests,,USA
GLP^B,Global Partners LP 9.50% Series B Fixed Rate Cumulative Redeemable Perpetual Preferred Units representing limited partner interests,,USA
ARAV,Aravive Inc. Common Stock,NMS,USA
ARAY,Accuray Incorporated Common Stock,NMS,USA
ARBG,Aequi Acquisition Corp. Class A Common Stock,NCM,USA
ARBGU,Aequi Acquisition Corp. Unit,NCM,USA
ARBGW,Aequi Acquisition Corp. warrants,NCM,USA
ARC,ARC Document Solutions Inc. Common Stock,NYQ,USA
ARCB,ArcBest Corporation Common Stock,NMS,USA
ARCC,Ares Capital Corporation Common Stock,NGM,USA
GLU^B,The Gabelli Global Utility and Income Trust Series B Cumulative Puttable and Callable Preferred Shares,,USA
ARCH,Arch Resources Inc. Class A Common Stock,NYQ,USA
ARCKU,Arbor Rapha Capital Bioholdings Corp. I Units,NGM,USA
ARDC,Ares Dynamic Credit Allocation Fund Inc. Common Shares,NYQ,USA
ARDS,Aridis Pharmaceuticals Inc. Common Stock,NCM,USA
ARDX,Ardelyx Inc. Common Stock,NGM,USA
ARE,Alexandria Real Estate Equities Inc. Common Stock,NYQ,USA
AREC,American Resources Corporation Class A Common Stock,NCM,USA
ARGUU,Argus Capital Corp. Unit,NGM,USA
ARI,Apollo Commercial Real Estate Finance Inc,NYQ,USA
ARKO,ARKO Corp. Common Stock,NCM,USA
ARKOW,ARKO Corp. Warrant,NCM,USA
ARKR,Ark Restaurants Corp. Common Stock,NGM,USA
ARL,American Realty Investors Inc. Common Stock,NYQ,USA
ARLO,Arlo Technologies Inc. Common Stock,NYQ,USA
ARLP,Alliance Resource Partners L.P. Common Units representing Limited Partners Interests,NMS,USA
ARMP,Armata Pharmaceuticals Inc. Common Stock,ASE,USA
ARNA,Arena Pharmaceuticals Inc. Common Stock,NMS,USA
