code,stock_name,exchange,country
HLAHU,Hamilton Lane Alliance Holdings I Inc. Unit,NCM,USA
HLAHW,Hamilton Lane Alliance Holdings I Inc. Warrant,NCM,USA
HLBZ,Helbiz Inc. Class A Common stock,NCM,USA
HLBZW,Helbiz Inc. Warrant,NCM,USA
HLI,Houlihan Lokey Inc. Class A Common Stock,NYQ,USA
HLIO,Helios Technologies Inc. Common Stock,NYQ,USA
HLIT,Harmonic Inc. Common Stock,NMS,USA
HLLY,Holley Inc. Common Stock,NYQ,USA
HLMN,Hillman Solutions Corp. Common Stock,NGM,USA
HLMNW,Hillman Solutions Corp. Warrant,NGM,USA
HLNE,Hamilton Lane Incorporated Class A Common Stock,NMS,USA
HLTH,Cue Health Inc. Common Stock,NMS,USA
HLX,Helix Energy Solutions Group Inc. Common Stock,NYQ,USA
HLXA,Helix Acquisition Corp. Class A Ordinary Shares,NCM,USA
HMCO,HumanCo Acquisition Corp. Class A Common Stock,NCM,USA
HMCOU,HumanCo Acquisition Corp. Unit,NCM,USA
HMCOW,HumanCo Acquisition Corp. Warrant,NCM,USA
HMG,HMG/Courtland Properties Inc. Common Stock,ASE,USA
HMHC,Houghton Mifflin Harcourt Company Common Stock,NMS,USA
HMN,Horace Mann Educators Corporation Common Stock,NYQ,USA
HMNF,HMN Financial Inc. Common Stock,NGM,USA
HMPT,Home Point Capital Inc Common Stock,NMS,USA
HMST,HomeStreet Inc. Common Stock,NMS,USA
HMTV,Hemisphere Media Group Inc. Class A Common Stock,NGM,USA
RC^C,Ready Capital Corporation 6.25% Series C Cumulative Convertible Preferred Stock,,USA
RC^E,Ready Capital Corporation 6.50% Series E Cumulative Redeemable Preferred Stock,,USA
HNGR,Hanger Inc. Common Stock,NYQ,USA
HNI,HNI Corporation Common Stock,NYQ,USA
HNNA,Hennessy Advisors Inc. Common Stock,NGM,USA
HNNAZ,Hennessy Advisors Inc. 4.875% Notes due 2026,NGM,USA
HNRG,Hallador Energy Company Common Stock,NCM,USA
HNST,The Honest Company Inc. Common Stock,NMS,USA
HNW,Pioneer Diversified High Income Fund Inc.,NYQ,USA
HOFT,Hooker Furnishings Corporation Common Stock,NMS,USA
HOFV,Hall of Fame Resort & Entertainment Company Common Stock,NCM,USA
HOFVW,Hall of Fame Resort &amp; Entertainment Company Warrant,NCM,USA
HOG,Harley-Davidson Inc. Common Stock,NYQ,USA
HOLX,Hologic Inc. Common Stock,NMS,USA
HOMB,Home BancShares Inc. Common Stock,NMS,USA
HON,Honeywell International Inc. Common Stock,NMS,USA
HONE,HarborOne Bancorp Inc. Common Stock,NMS,USA
HOOD,Robinhood Markets Inc. Class A Common Stock,NMS,USA
HOOK,HOOKIPA Pharma Inc. Common Stock,NMS,USA
HOPE,Hope Bancorp Inc. Common Stock,NMS,USA
HOTH,Hoth Therapeutics Inc. Common Stock,NCM,USA
HOV,Hovnanian Enterprises Inc. Class A Common Stock,NYQ,USA
HOVNP,Hovnanian Enterprises Inc Dep Shr Srs A Pfd,NGM,USA
HOWL,Werewolf Therapeutics Inc. Common Stock,NMS,USA
HP,Helmerich & Payne Inc. Common Stock,NYQ,USA
HPE,Hewlett Packard Enterprise Company Common Stock,NYQ,USA
HPF,John Hancock Pfd Income Fund II Pfd Income Fund II,NYQ,USA
HPI,John Hancock Preferred Income Fund Common Shares of Beneficial Interest,NYQ,USA
HPK,HighPeak Energy Inc. Common Stock,NGM,USA
HPKEW,HighPeak Energy Inc. Warrant,NGM,USA
HPLTU,Home Plate Acquisition Corporation Unit,NGM,USA
HPP,Hudson Pacific Properties Inc. Common Stock,NYQ,USA
HPQ,HP Inc. Common Stock,NYQ,USA
HPS,John Hancock Preferred Income Fund III Preferred Income Fund III,NYQ,USA
HPX,HPX Corp. Class A Ordinary Shares,NYQ,USA
HQH,Tekla Healthcare Investors Common Stock,NYQ,USA
HQI,HireQuest Inc. Common Stock (DE),NCM,USA
HQL,TeklaLife Sciences Investors Common Stock,NYQ,USA
HQY,HealthEquity Inc. Common Stock,NMS,USA
HR,Healthcare Realty Trust Incorporated Common Stock,NYQ,USA
HRB,H&R Block Inc. Common Stock,NYQ,USA
HRC,Hill-Rom Holdings Inc Common Stock,NYQ,USA
HRL,Hormel Foods Corporation Common Stock,NYQ,USA
HRMY,Harmony Biosciences Holdings Inc. Common Stock,NGM,USA
HROW,Harrow Health Inc. Common Stock,NGM,USA
HROWL,Harrow Health Inc. 8.625% Senior Notes due 2026,NGM,USA
HRTX,Heron Therapeutics Inc. Common Stock,NCM,USA
HRZN,Horizon Technology Finance Corporation Common Stock,NMS,USA
HSAQ,Health Sciences Acquisitions Corporation 2 Ordinary Shares,NCM,USA
HSC,Harsco Corporation Common Stock,NYQ,USA
HSDT,Helius Medical Technologies Inc. Class A Common Stock (DE),NCM,USA
HSIC,Henry Schein Inc. Common Stock,NMS,USA
HSII,Heidrick & Struggles International Inc. Common Stock,NMS,USA
HSKA,Heska Corporation Common Stock,NCM,USA
HSON,Hudson Global Inc. Common Stock,NMS,USA
HST,Host Hotels & Resorts Inc. Common Stock,NMS,USA
HSTM,HealthStream Inc. Common Stock,NMS,USA
HSTO,Histogen Inc. Common Stock,NCM,USA
HSY,The Hershey Company Common Stock,NYQ,USA
HT,Hersha Hospitality Trust Class A Common Shares of Beneficial Interest,NYQ,USA
HTA,Healthcare Trust of America Inc. Class A Common Stock,NYQ,USA
HTBI,HomeTrust Bancshares Inc. Common Stock,NMS,USA
REXR^B,Rexford Industrial Realty Inc. 5.875% Series B Cumulative Redeemable Preferred Stock,,USA
REXR^C,Rexford Industrial Realty Inc. 5.625% Series C Cumulative Redeemable Preferred Stock par value $0.01 per share,,USA
HTBK,Heritage Commerce Corp Common Stock,NMS,USA
HTBX,Heat Biologics Inc. Common Stock,NCM,USA
RF^B,Regions Financial Corporation Depositary Shares Representing 1/40th Perpetual Preferred Series B,,USA
RF^C,Regions Financial Corporation Depositary Shares each Representing a 1/40th Interest in a  Share of 5.700% Fixed-to-Floating Rate Non-Cumulative  Perpetual Preferred Stock Series C,,USA
RF^E,Regions Financial Corporation Depositary Shares Each Representing a 1/40th Interest in a Share of 4.45% Non-Cumulative Perpetual Preferred Stock Series E,,USA
HTD,John Hancock Tax Advantaged Dividend Income Fund Common Shares of Beneficial Interest,NYQ,USA
HTFB,Horizon Technology Finance Corporation 4.875% Notes due 2026,NYQ,USA
HTGC,Hercules Capital Inc. Common Stock,NYQ,USA
HTGM,HTG Molecular Diagnostics Inc. Common Stock,NCM,USA
HTH,Hilltop Holdings Inc.,NYQ,USA
HTIA,Healthcare Trust Inc. 7.375% Series A Cumulative Redeemable Perpetual Preferred Stock,NGM,USA
HTIBP,Healthcare Trust Inc. 7.125% Series B Cumulative Redeemable Perpetual Preferred Stock,NGM,USA
HTLD,Heartland Express Inc. Common Stock,NMS,USA
HTLF,Heartland Financial USA Inc. Common Stock,NMS,USA
HTLFP,Heartland Financial USA Inc. Depositary Shares each representing a 1/400th ownership interest in a share of 7.00% Fixed-Rate Reset Non-Cumulative Perpetual Preferred Stock Series E,NMS,USA
HTY,John Hancock Tax-Advantaged Global Shareholder Yield Fund Common Shares of Beneficial Interest,NYQ,USA
HUBB,Hubbell Inc Common Stock,NYQ,USA
HUBG,Hub Group Inc. Class A Common Stock,NMS,USA
HUBS,HubSpot Inc. Common Stock,NYQ,USA
HUM,Humana Inc. Common Stock,NYQ,USA
HUMA,Humacyte Inc. Common Stock,NMS,USA
HUMAW,Humacyte Inc. Warrant,NMS,USA
HUN,Huntsman Corporation Common Stock,NYQ,USA
HURC,Hurco Companies Inc. Common Stock,NMS,USA
HURN,Huron Consulting Group Inc. Common Stock,NMS,USA
HUSA,Houston American Energy Corporation Common Stock,ASE,USA
HUYA,HUYA Inc. American depositary shares each  representing one Class A ordinary share,NYQ,USA
HVBC,HV Bancorp Inc. Common Stock,NCM,USA
HVT,Haverty Furniture Companies Inc. Common Stock,NYQ,USA
HVT/A,Haverty Furniture Companies Inc.,NYQ,USA
HWBK,Hawthorn Bancshares Inc. Common Stock,NMS,USA
HWC,Hancock Whitney Corporation Common Stock,NMS,USA
HWCPZ,Hancock Whitney Corporation 6.25% Subordinated Notes due 2060,NMS,USA
HWEL,Healthwell Acquisition Corp. I Class A Common Stock,NCM,USA
HWELU,Healthwell Acquisition Corp. I Unit,NCM,USA
HWELW,Healthwell Acquisition Corp. I Warrant,NCM,USA
HWKN,Hawkins Inc. Common Stock,NMS,USA
HWM,Howmet Aerospace Inc. Common Stock,NYQ,USA
HXL,Hexcel Corporation Common Stock,NYQ,USA
HY,Hyster-Yale Materials Handling Inc. Class A Common Stock,NYQ,USA
HYAC,Haymaker Acquisition Corp. III Class A common stock,NCM,USA
HYACU,Haymaker Acquisition Corp. III Unit,NCM,USA
RLGT,Radiant Logistics Inc. Common Stock,,USA
HYACW,Haymaker Acquisition Corp. III Warrant,NCM,USA
HYB,New America High Income Fund Inc. (The) Common Stock,NYQ,USA
HYFM,Hydrofarm Holdings Group Inc. Common Stock,NMS,USA
RLJ^A,RLJ Lodging Trust $1.95 Series A Cumulative Convertible  Preferred Shares,,USA
HYMC,Hycroft Mining Holding Corporation Class A Common Stock,NCM,USA
HYMCL,Hycroft Mining Holding Corporation Warrants,NCM,USA
HYMCW,Hycroft Mining Holding Corporation  Warrant,NCM,USA
HYMCZ,Hycroft Mining Holding Corporation Warrant,NCM,USA
HYRE,HyreCar Inc. Common Stock,NCM,USA
HYT,Blackrock Corporate High Yield Fund Inc. Common Stock,NYQ,USA
HYZN,Hyzon Motors Inc. Class A Common Stock,NMS,USA
HYZNW,Hyzon Motors Inc. Warrants,NMS,USA
HZN,Horizon Global Corporation Common Shares,NYQ,USA
HZO,MarineMax Inc.  (FL) Common Stock,NYQ,USA
HZON,Horizon Acquisition Corporation II Class A Ordinary Shares,NYQ,USA
IAC,IAC/InterActiveCorp Common Stock,NMS,USA
IAE,Voya Asia Pacific High Dividend Equity Income Fund ING Asia Pacific High Dividend Equity Income Fund Common Shares of Beneficial Interest,NYQ,USA
IAF,Aberdeen Australia Equity Fund Inc Common Stock,NYQ,USA
IART,Integra LifeSciences Holdings Corporation Common Stock,NMS,USA
IAS,Integral Ad Science Holding Corp. Common Stock,NMS,USA
IBCP,Independent Bank Corporation Common Stock,NMS,USA
IBIO,iBio Inc. Common Stock,ASE,USA
IBKR,Interactive Brokers Group Inc. Class A Common Stock,NMS,USA
IBM,International Business Machines Corporation Common Stock,NYQ,USA
IBOC,International Bancshares Corporation Common Stock,NMS,USA
IBRX,ImmunityBio Inc. Common Stock,NMS,USA
IBTX,Independent Bank Group Inc Common Stock,NMS,USA
ICAD,iCAD Inc. Common Stock,NCM,USA
ICBK,County Bancorp Inc. Common Stock,NGM,USA
ICCC,ImmuCell Corporation Common Stock,NCM,USA
ICCH,ICC Holdings Inc. Common Stock,NCM,USA
ICE,Intercontinental Exchange Inc. Common Stock,NYQ,USA
ICFI,ICF International Inc. Common Stock,NMS,USA
ICHR,Ichor Holdings Ordinary Shares,NMS,USA
ICMB,Investcorp Credit Management BDC Inc. Common Stock,NMS,USA
ICPT,Intercept Pharmaceuticals Inc. Common Stock,NMS,USA
ICUI,ICU Medical Inc. Common Stock,NMS,USA
ICVX,Icosavax Inc. Common Stock,NMS,USA
ID,PARTS iD Inc. Class A Common Stock,ASE,USA
IDA,IDACORP Inc. Common Stock,NYQ,USA
IDCC,InterDigital Inc. Common Stock,NMS,USA
IDE,Voya Infrastructure Industrials and Materials Fund Common Shares of Beneficial Interest,NYQ,USA
IDEX,Ideanomics Inc. Common Stock,NCM,USA
IDN,Intellicheck Inc. Common Stock,NGM,USA
IDRA,Idera Pharmaceuticals Inc. Common Stock,NCM,USA
IDT,IDT Corporation Class B Common Stock,NYQ,USA
IDXX,IDEXX Laboratories Inc. Common Stock,NMS,USA
IDYA,IDEAYA Biosciences Inc. Common Stock,NMS,USA
IEA,Infrastructure and Energy Alternatives Inc. Common Stock,NCM,USA
IEAWW,Infrastructure and Energy Alternatives Inc. Warrant,NCM,USA
IEP,Icahn Enterprises L.P. Common Stock,NMS,USA
IESC,IES Holdings Inc. Common Stock,NGM,USA
IEX,IDEX Corporation Common Stock,NYQ,USA
IFF,International Flavors & Fragrances Inc. Common Stock,NYQ,USA
IFMK,iFresh Inc. Common Stock,NCM,USA
IFN,India Fund Inc. (The) Common Stock,NYQ,USA
RPT^D,RPT Realty 7.25% ,,USA
IGA,Voya Global Advantage and Premium Opportunity Fund Common Shares of Beneficial Interest,NYQ,USA
IGAC,IG Acquisition Corp. Class A Common Stock,NCM,USA
IGACU,IG Acquisition Corp. Unit,NCM,USA
IGACW,IG Acquisition Corp. Warrant,NCM,USA
IGC,India Globalization Capital Inc. Common Stock,ASE,USA
IGD,Voya Global Equity Dividend and Premium Opportunity Fund,NYQ,USA
IGI,Western Asset Investment Grade Defined Opportunity Trust Inc. Common Stock,NYQ,USA
IGMS,IGM Biosciences Inc. Common Stock,NMS,USA
IGNY,Ignyte Acquisition Corp. Common Stock,NCM,USA
IGNYU,Ignyte Acquisition Corp. Unit,NCM,USA
IGNYW,Ignyte Acquisition Corp. Warrant,NCM,USA
IGR,CBRE Global Real Estate Income Fund Common Shares of Beneficial Interest,NYQ,USA
IGT,International Game Technology Ordinary Shares,NYQ,USA
IH,iHuman Inc. American depositary shares each representing five Class A ordinary shares,NYQ,USA
IHC,Independence Holding Company Common Stock,NYQ,USA
IHD,Voya Emerging Markets High Income Dividend Equity Fund Common Shares,NYQ,USA
IHIT,Invesco High Income 2023 Target Term Fund Common Shares of Beneficial Interest,NYQ,USA
IHRT,iHeartMedia Inc. Class A Common Stock,NMS,USA
IHT,InnSuites Hospitality Trust Shares of Beneficial Interest,ASE,USA
IIF,Morgan Stanley India Investment Fund Inc. Common Stock,NYQ,USA
III,Information Services Group Inc. Information Services Group Inc. Common Stock,NGM,USA
IIII,INSU Acquisition Corp. III Class A Common Stock,NCM,USA
IIIIU,INSU Acquisition Corp. III Unit,NCM,USA
IIIIW,INSU Acquisition Corp. III Warrant,NCM,USA
IIIN,Insteel Industries Inc. Common Stock,NYQ,USA
IIIV,i3 Verticals Inc. Class A Common Stock,NMS,USA
IIM,Invesco Value Municipal Income Trust Common Stock,NYQ,USA
IIN,Intricon Corporation Common Stock,NGM,USA
IIPR,Innovative Industrial Properties Inc. Common Stock,NYQ,USA
IIVI,II-VI Incorporated Common Stock,NMS,USA
IIVIP,II-VI Incorporated 6.00% Series A Mandatory Convertible Preferred Stock,NMS,USA
IKNA,Ikena Oncology Inc. Common Stock,NGM,USA
IKNX,Ikonics Corporation,NCM,USA
IKT,Inhibikase Therapeutics Inc. Common Stock,NCM,USA
ILMN,Illumina Inc. Common Stock,NMS,USA
ILPT,Industrial Logistics Properties Trust Common Shares of Beneficial Interest,NMS,USA
IMAC,IMAC Holdings Inc. Common Stock,NCM,USA
IMACW,IMAC Holdings Inc. Warrant,NCM,USA
IMAQ,International Media Acquisition Corp. Class A Common Stock,NCM,USA
IMAQR,International Media Acquisition Corp. Rights,NCM,USA
IMAQU,International Media Acquisition Corp. Unit,NCM,USA
IMAQW,International Media Acquisition Corp. Warrants,NCM,USA
IMBI,iMedia Brands Inc. Class A Common Stock,NGM,USA
IMBIL,iMedia Brands Inc. 8.5% Senior Notes Due 2026,NGM,USA
IMGN,ImmunoGen Inc. Common Stock,NMS,USA
IMGO,Imago BioSciences Inc. Common stock,NMS,USA
IMH,Impac Mortgage Holdings Inc. Common Stock ,ASE,USA
IMKTA,Ingles Markets Incorporated Class A Common Stock,NMS,USA
IMMR,Immersion Corporation Common Stock,NMS,USA
IMNM,Immunome Inc. Common Stock,NCM,USA
IMPL,Impel NeuroPharma Inc. Common Stock,NGM,USA
IMRA,IMARA Inc. Common Stock,NMS,USA
IMRX,Immuneering Corporation Class A Common Stock,NGM,USA
IMUX,Immunic Inc. Common Stock,NMS,USA
IMVT,Immunovant Inc. Common Stock,NMS,USA
IMXI,International Money Express Inc. Common Stock,NCM,USA
SACH^A,Sachem Capital Corp. 7.75% Series A Cumulative Redeemable Preferred Stock,,USA
INAB,IN8bio Inc. Common Stock,NGM,USA
INBK,First Internet Bancorp Common Stock,NMS,USA
INBKZ,First Internet Bancorp 6.0% Fixed-to-Floating Rate Subordinated Notes Due 2029,NMS,USA
INBX,Inhibrx Inc. Common Stock,NGM,USA
INCY,Incyte Corp. Common Stock,NMS,USA
INDB,Independent Bank Corp. Common Stock,NMS,USA
INDI,indie Semiconductor Inc. Class A Common Stock,NCM,USA
INDIW,indie Semiconductor Inc. Warrant,NCM,USA
INDP,Indaptus Therapeutics Inc. Common Stock,NCM,USA
INDT,INDUS Realty Trust Inc. (MD) Common Stock,NGM,USA
INFI,Infinity Pharmaceuticals Inc. Common Stock,NMS,USA
INFN,Infinera Corporation Common Stock,NMS,USA
INFU,InfuSystems Holdings Inc. Common Stock,ASE,USA
INGN,Inogen Inc Common Stock,NMS,USA
INGR,Ingredion Incorporated Common Stock,NYQ,USA
INKA,KludeIn I Acquisition Corp. Class A Common Stock,NCM,USA
INKAU,KludeIn I Acquisition Corp. Unit,NCM,USA
INKAW,KludeIn I Acquisition Corp. Warrant,NCM,USA
INKT,MiNK Therapeutics Inc. Common Stock,NGM,USA
INMB,INmune Bio Inc. Common stock,NCM,USA
INN,Summit Hotel Properties Inc. Common Stock,NYQ,USA
INNV,InnovAge Holding Corp. Common Stock,NMS,USA
INO,Inovio Pharmaceuticals Inc. Common Stock,NMS,USA
INOD,Innodata Inc. Common Stock,NGM,USA
INOV,Inovalon Holdings Inc. Class A Common Stock,NMS,USA
INPX,Inpixon Common Stock,NCM,USA
INS,Intelligent Systems Corporation Common Stock,NYQ,USA
INSE,Inspired Entertainment Inc. Common Stock,NCM,USA
INSG,Inseego Corp. Common Stock,NMS,USA
INSI,Insight Select Income Fund,NYQ,USA
INSM,Insmed Inc. Common Stock,NMS,USA
INSP,Inspire Medical Systems Inc. Common Stock,NYQ,USA
INT,World Fuel Services Corporation Common Stock,NYQ,USA
INTA,Intapp Inc. Common Stock,NMS,USA
INTC,Intel Corporation Common Stock,NMS,USA
INTG,Intergroup Corporation (The) Common Stock,NCM,USA
INTT,inTest Corporation Common Stock,ASE,USA
INTU,Intuit Inc. Common Stock,NMS,USA
INTZ,Intrusion Inc. Common Stock,NCM,USA
INUV,Inuvo Inc.,ASE,USA
INVA,Innoviva Inc. Common Stock,NMS,USA
INVE,Identiv Inc. Common Stock,NCM,USA
INVH,Invitation Homes Inc. Common Stock,NYQ,USA
INVO,INVO BioScience Inc. Common Stock,NCM,USA
INZY,Inozyme Pharma Inc. Common Stock,NMS,USA
IO,Ion Geophysical Corporation Common Stock,NYQ,USA
SCE^G,SCE Trust II Trust Preferred Securities,,USA
SCE^H,SCE Trust III Fixed/Floating Rate Trust Preference Securities,,USA
SCE^J,Southern California Edison Company 5.375% Fixed-to-Floating Rate Trust Preference Securities,,USA
SCE^K,Southern California Edison Company 5.45% Fixed-to-Floating Rate Trust Preference Securities,,USA
SCE^L,SCE TRUST VI,,USA
IOACU,Innovative International Acquisition Corp. Unit,NGM,USA
IONM,Assure Holdings Corp. Common Stock,NCM,USA
IONQ,IonQ Inc. Common Stock,NYQ,USA
SCHW^D,The Charles Schwab Corporation Depositary Shares each representing 1/40th interest in a share of 5.95% Non-Cumulative Perpetual Preferred Stock Series D,,USA
SCHW^J,The Charles Schwab Corporation Depositary Shares Each Representing a 1/40th Interest in a Share of 4.450% Non-Cumulative Perpetual Preferred Stock Series J,,USA
IONS,Ionis Pharmaceuticals Inc. Common Stock,NMS,USA
IOR,Income Opportunity Realty Investors Inc. Common Stock,ASE,USA
IOSP,Innospec Inc. Common Stock,NMS,USA
IOVA,Iovance Biotherapeutics Inc. Common Stock,NGM,USA
IP,International Paper Company Common Stock,NYQ,USA
IPAR,Inter Parfums Inc. Common Stock,NMS,USA
IPAXU,Inflection Point Acquisition Corp. Units,NCM,USA
IPDN,Professional Diversity Network Inc. Common Stock,NCM,USA
IPG,Interpublic Group of Companies Inc. (The) Common Stock,NYQ,USA
IPGP,IPG Photonics Corporation Common Stock,NMS,USA
IPI,Intrepid Potash Inc Common Stock,NYQ,USA
IPLDP,Interstate Power & Light Company Perp Prd Ser D,NMS,USA
IPOD,Social Capital Hedosophia Holdings Corp. IV Class A Ordinary Shares,NYQ,USA
IPOF,Social Capital Hedosophia Holdings Corp. VI Class A Ordinary Shares,NYQ,USA
IPSC,Century Therapeutics Inc. Common Stock,NMS,USA
IPVI,InterPrivate IV InfraTech Partners Inc. Class A Common Stock,NCM,USA
IPVIU,InterPrivate IV InfraTech Partners Inc. Units,NCM,USA
IPVIW,InterPrivate IV InfraTech Partners Inc. Warrant,NCM,USA
IPW,iPower Inc. Common Stock,NCM,USA
IPWR,Ideal Power Inc. Common Stock,NCM,USA
IQI,Invesco Quality Municipal Income Trust Common Stock,NYQ,USA
IQV,IQVIA Holdings Inc. Common Stock,NYQ,USA
IR,Ingersoll Rand Inc. Common Stock,NYQ,USA
IRBT,iRobot Corporation Common Stock,NMS,USA
IRDM,Iridium Communications Inc Common Stock,NMS,USA
IRIX,IRIDEX Corporation Common Stock,NGM,USA
IRL,New Ireland Fund Inc (The) Common Stock,NYQ,USA
IRM,Iron Mountain Incorporated (Delaware)Common Stock REIT,NYQ,USA
IRMD,iRadimed Corporation Common Stock,NCM,USA
IRNT,IronNet Inc. Common Stock,NYQ,USA
IROQ,IF Bancorp Inc. Common Stock,NCM,USA
IRT,Independence Realty Trust Inc. Common Stock,NYQ,USA
IRTC,iRhythm Technologies Inc. Common Stock,NMS,USA
IRWD,Ironwood Pharmaceuticals Inc. Class A Common Stock,NMS,USA
ISAA,Iron Spark I Inc. Class A Common Stock,NCM,USA
ISBC,Investors Bancorp Inc. Common Stock,NMS,USA
ISD,PGIM High Yield Bond Fund Inc.,NYQ,USA
ISDR,Issuer Direct Corporation Common Stock,ASE,USA
ISEE,IVERIC bio Inc. Common Stock,NMS,USA
ISIG,Insignia Systems Inc. Common Stock,NCM,USA
ISLE,Isleworth Healthcare Acquisition Corporation Common stock,NCM,USA
ISLEW,Isleworth Healthcare Acquisition Corporation Warrant,NCM,USA
ISO,IsoPlexis Corporation Common Stock,NMS,USA
ISPC,iSpecimen Inc. Common Stock,NCM,USA
ISR,IsoRay Inc. Common Stock (DE),ASE,USA
ISRG,Intuitive Surgical Inc. Common Stock,NMS,USA
SF^B,Stifel Financial Corporation Depositary Shares Each Representing 1/1000th  Interest in a Share of 6.25% Non-Cumulative  Preferred Stock Series B,,USA
SF^C,Stifel Financial Corporation Depositary Shares Each Representing 1/1000th Interest in a Share of 6.125% Non Cumulative Preferred Stock Series C,,USA
SF^D,Stifel Financial Corporation Depositary Shares Each Representing 1/1000th Interest in a Share of 4.50% Non-Cumulative Preferred Stock Series D,,USA
ISSC,Innovative Solutions and Support Inc. Common Stock,NMS,USA
ISTR,Investar Holding Corporation Common Stock,NGM,USA
ISUN,iSun Inc. Common Stock,NCM,USA
IT,Gartner Inc. Common Stock,NYQ,USA
ITCI,Intra-Cellular Therapies Inc. Common Stock,NMS,USA
ITGR,Integer Holdings Corporation Common Stock,NYQ,USA
ITHX,ITHAX Acquisition Corp. Class A Ordinary Shares,NCM,USA
ITHXW,ITHAX Acquisition Corp. Warrant,NCM,USA
ITI,Iteris Inc. Common Stock,NCM,USA
ITIC,Investors Title Company Common Stock,NMS,USA
ITOS,iTeos Therapeutics Inc. Common Stock,NGM,USA
ITQ,Itiquira Acquisition Corp. Class A Ordinary Shares,NCM,USA
ITQRU,Itiquira Acquisition Corp. Unit,NCM,USA
ITQRW,Itiquira Acquisition Corp. Warrant,NCM,USA
ITRI,Itron Inc. Common Stock,NMS,USA
ITT,ITT Inc. Common Stock ,NYQ,USA
ITW,Illinois Tool Works Inc. Common Stock,NYQ,USA
IVAC,Intevac Inc. Common Stock,NMS,USA
IVC,Invacare Corporation Common Stock,NYQ,USA
IVR,INVESCO MORTGAGE CAPITAL INC Common Stock,NYQ,USA
IVZ,Invesco Ltd Common Stock,NYQ,USA
IZEA,IZEA Worldwide Inc. Common Stock,NCM,USA
J,Jacobs Engineering Group Inc. Common Stock,NYQ,USA
JACK,Jack In The Box Inc. Common Stock,NMS,USA
JAGX,Jaguar Health Inc. Common Stock,NCM,USA
JAKK,JAKKS Pacific Inc. Common Stock,NMS,USA
JAMF,Jamf Holding Corp. Common Stock,NMS,USA
JAN,JanOne Inc. Common Stock (NV),NCM,USA
JANX,Janux Therapeutics Inc. Common Stock,NGM,USA
JAQC,Jupiter Acquisition Corporation Common stock,NCM,USA
JAQCU,Jupiter Acquisition Corporation Units,NCM,USA
JAQCW,Jupiter Acquisition Corporation Warrants,NCM,USA
JBGS,JBG SMITH Properties Common Shares ,NYQ,USA
JBHT,J.B. Hunt Transport Services Inc. Common Stock,NMS,USA
JBK,Lehman ABS 3.50 3.50% Adjustable Corp Backed Tr Certs GS Cap I,NYQ,USA
JBL,Jabil Inc. Common Stock,NYQ,USA
SHO^H,Sunstone Hotel Investors Inc. 6.125% Series H Cumulative Redeemable Preferred Stock,,USA
SHO^I,Sunstone Hotel Investors Inc. 5.70% Series I Cumulative Redeemable Preferred Stock,,USA
JBLU,JetBlue Airways Corporation Common Stock,NMS,USA
JBSS,John B. Sanfilippo & Son Inc. Common Stock,NMS,USA
JBT,John Bean Technologies Corporation Common Stock,NYQ,USA
JCE,Nuveen Core Equity Alpha Fund Nuveen Core Equity Alpha Fund Common Shares of Beneficial Interest,NYQ,USA
JCIC,Jack Creek Investment Corp. Class A Ordinary Shares,NCM,USA
JCICU,Jack Creek Investment Corp. Units,NCM,USA
JCICW,Jack Creek Investment Corp. Warrants,NCM,USA
SI^A,Silvergate Capital Corporation Depositary Shares Each Representing a 1/40th Interest in a Share of 5.375% Fixed Rate Non-Cumulative Perpetual Preferred Stock Series A,,USA
JCO,Nuveen Credit Opportunities 2022 Target Term Fund Common Shares of Beneficial Interest,NYQ,USA
JCS,Communications Systems Inc. Common Stock,NGM,USA
JCTCF,Jewett-Cameron Trading Company Common Shares,NCM,USA
JDD,Nuveen Diversified Dividend and Income Fund Shares of Beneficial Interest,NYQ,USA
JEF,Jefferies Financial Group Inc. Common Stock,NYQ,USA
JELD,JELD-WEN Holding Inc. Common Stock,NYQ,USA
JEQ,Aberdeen Japan Equity Fund Inc.  Common Stock,NYQ,USA
JFR,Nuveen Floating Rate Income Fund Common Stock,NYQ,USA
JGH,Nuveen Global High Income Fund Common Shares of Beneficial Interest,NYQ,USA
JHI,John Hancock Investors Trust Common Stock,NYQ,USA
JHS,John Hancock Income Securities Trust Common Stock,NYQ,USA
JJSF,J & J Snack Foods Corp. Common Stock,NMS,USA
JKHY,Jack Henry & Associates Inc. Common Stock,NMS,USA
SITC^A,SITE Centers Corp. 6.375% Class A Preferred Shares,,USA
JLL,Jones Lang LaSalle Incorporated Common Stock,NYQ,USA
JLS,Nuveen Mortgage and Income Fund,NYQ,USA
JMM,Nuveen Multi-Market Income Fund (MA),NYQ,USA
JMP,JMP Group LLC Common Shares,NYQ,USA
JMPNZ,JMP Group LLC 6.875% Senior Notes due 2029,NGM,USA
JNCE,Jounce Therapeutics Inc. Common Stock,NMS,USA
JNJ,Johnson & Johnson Common Stock,NYQ,USA
JNPR,Juniper Networks Inc. Common Stock,NYQ,USA
JOAN,JOANN Inc. Common Stock,NGM,USA
JOB,GEE Group Inc. Common Stock,ASE,USA
JOBY,Joby Aviation Inc. Common Stock,NYQ,USA
JOE,St. Joe Company (The) Common Stock,NYQ,USA
JOF,Japan Smaller Capitalization Fund Inc Common Stock,NYQ,USA
JOFF,JOFF Fintech Acquisition Corp. Class A Common Stock,NCM,USA
JOFFU,JOFF Fintech Acquisition Corp. Unit,NCM,USA
JOFFW,JOFF Fintech Acquisition Corp. Warrant,NCM,USA
JOUT,Johnson Outdoors Inc. Class A Common Stock,NMS,USA
JPC,Nuveen Preferred & Income Opportunities Fund,NYQ,USA
JPM,JP Morgan Chase & Co. Common Stock,NYQ,USA
JPS,Nuveen Preferred & Income Securities Fund,NYQ,USA
JPT,Nuveen Preferred and Income 2022 Term Fund Common Shares of Beneficial Interest,NYQ,USA
JQC,Nuveen Credit Strategies Income Fund Shares of Beneficial Interest,NYQ,USA
JRI,Nuveen Real Asset Income and Growth Fund Common Shares of Beneficial Interest,NYQ,USA
JRO,Nuveen Floating Rate Income Opportuntiy Fund Shares of Beneficial Interest,NYQ,USA
JRS,Nuveen Real Estate Income Fund Common Shares of Beneficial Interest,NYQ,USA
JRSH,Jerash Holdings (US) Inc. Common Stock,NCM,USA
JSD,Nuveen Short Duration Credit Opportunities Fund Common Shares of Beneficial Interest,NYQ,USA
JSM,Navient Corporation 6% Senior Notes due December 15 2043,NMS,USA
SLG^I,SL Green Realty Corporation Preferred Series I,,USA
JSPR,Jasper Therapeutics Inc. Common Stock,NCM,USA
JSPRW,Japer Therapeutics Inc. Warrants,NCM,USA
JTA,Nuveen Tax-Advantaged Total Return Strategy Fund Common Share of Beneficial Interest,NYQ,USA
